No.	Time	Source	Destination	Protocol	Length	Info
1	0.000000	192.168.50.152	192.168.50.156	TCP	60	2454 ¡ú 9 [SYN] Seq=0 Win=512 Len=0
2	1.000300	192.168.50.152	192.168.50.156	TCP	60	2455 ¡ú 10 [SYN] Seq=0 Win=512 Len=0
3	2.000486	192.168.50.152	192.168.50.156	TCP	60	2456 ¡ú 11 [SYN] Seq=0 Win=512 Len=0
4	3.000909	192.168.50.152	192.168.50.156	TCP	60	2457 ¡ú 12 [SYN] Seq=0 Win=512 Len=0
5	3.485126	192.168.50.156	180.163.252.201	TCP	55	50075 ¡ú 80 [ACK] Seq=1 Ack=1 Win=63328 Len=1
6	3.485217	180.163.252.201	192.168.50.156	TCP	60	80 ¡ú 50075 [ACK] Seq=1 Ack=2 Win=64240 Len=0
7	4.001727	192.168.50.152	192.168.50.156	TCP	60	2458 ¡ú 13 [SYN] Seq=0 Win=512 Len=0
8	5.002694	192.168.50.152	192.168.50.156	TCP	60	2459 ¡ú 14 [SYN] Seq=0 Win=512 Len=0
9	6.003606	192.168.50.152	192.168.50.156	TCP	60	2460 ¡ú 15 [SYN] Seq=0 Win=512 Len=0
10	7.004123	192.168.50.152	192.168.50.156	TCP	60	2461 ¡ú 16 [SYN] Seq=0 Win=512 Len=0
11	8.004933	192.168.50.152	192.168.50.156	TCP	60	2462 ¡ú 17 [SYN] Seq=0 Win=512 Len=0
12	9.005666	192.168.50.152	192.168.50.156	TCP	60	2463 ¡ú 18 [SYN] Seq=0 Win=512 Len=0
13	10.006694	192.168.50.152	192.168.50.156	TCP	60	2464 ¡ú 19 [SYN] Seq=0 Win=512 Len=0
14	11.006943	192.168.50.152	192.168.50.156	TCP	60	2465 ¡ú 20 [SYN] Seq=0 Win=512 Len=0
15	11.067655	fe80::ffff:ffff:fffe	ff02::2	ICMPv6	103	Router Solicitation
16	11.312020	fe80::8000:f227:d7ae:87d3	fe80::ffff:ffff:fffe	ICMPv6	151	Router Advertisement
17	12.007329	192.168.50.152	192.168.50.156	TCP	60	2466 ¡ú 21 [SYN] Seq=0 Win=512 Len=0
18	12.007397	192.168.50.156	192.168.50.152	TCP	58	21 ¡ú 2466 [SYN, ACK] Seq=0 Ack=1 Win=8192 Len=0 MSS=1460
19	12.007546	192.168.50.152	192.168.50.156	TCP	60	2466 ¡ú 21 [RST] Seq=1 Win=0 Len=0
20	13.007438	192.168.50.152	192.168.50.156	TCP	60	2467 ¡ú 22 [SYN] Seq=0 Win=512 Len=0
21	14.008374	192.168.50.152	192.168.50.156	TCP	60	2468 ¡ú 23 [SYN] Seq=0 Win=512 Len=0
22	15.009114	192.168.50.152	192.168.50.156	TCP	60	2469 ¡ú 24 [SYN] Seq=0 Win=512 Len=0
23	16.009926	192.168.50.152	192.168.50.156	TCP	60	2470 ¡ú 25 [SYN] Seq=0 Win=512 Len=0
24	16.809436	VMware_bf:0a:c7	VMware_7a:15:6b	ARP	42	Who has 192.168.50.152? Tell 192.168.50.156
25	16.809586	VMware_7a:15:6b	VMware_bf:0a:c7	ARP	60	192.168.50.152 is at 00:0c:29:7a:15:6b
26	17.011013	192.168.50.152	192.168.50.156	TCP	60	2471 ¡ú 26 [SYN] Seq=0 Win=512 Len=0
27	18.011616	192.168.50.152	192.168.50.156	TCP	60	2472 ¡ú 27 [SYN] Seq=0 Win=512 Len=0
28	19.012681	192.168.50.152	192.168.50.156	TCP	60	2473 ¡ú 28 [SYN] Seq=0 Win=512 Len=0
29	20.013660	192.168.50.152	192.168.50.156	TCP	60	2474 ¡ú 29 [SYN] Seq=0 Win=512 Len=0
30	20.497454	192.168.50.156	180.163.228.250	TCP	66	63571 ¡ú 80 [SYN, ECE, CWR] Seq=0 Win=8192 Len=0 MSS=1460 WS=256 SACK_PERM
31	20.503502	180.163.228.250	192.168.50.156	TCP	60	80 ¡ú 63571 [SYN, ACK] Seq=0 Ack=1 Win=64240 Len=0 MSS=1460
32	20.503580	192.168.50.156	180.163.228.250	TCP	54	63571 ¡ú 80 [ACK] Seq=1 Ack=1 Win=64240 Len=0
33	20.514494	192.168.50.156	180.163.228.250	TCP	336	63571 ¡ú 80 [PSH, ACK] Seq=1 Ack=1 Win=64240 Len=282 [TCP PDU reassembled in 35]
34	20.514739	180.163.228.250	192.168.50.156	TCP	60	80 ¡ú 63571 [ACK] Seq=1 Ack=283 Win=64240 Len=0
35	20.514757	192.168.50.156	180.163.228.250	HTTP	712	POST /cloudquery.php HTTP/1.1 
36	20.514860	180.163.228.250	192.168.50.156	TCP	60	80 ¡ú 63571 [ACK] Seq=1 Ack=941 Win=64240 Len=0
37	20.558506	180.163.228.250	192.168.50.156	HTTP	620	HTTP/1.1 200 OK  (application/octet-stream)
38	20.558711	192.168.50.156	180.163.228.250	TCP	54	63571 ¡ú 80 [FIN, ACK] Seq=941 Ack=567 Win=63674 Len=0
39	20.558835	180.163.228.250	192.168.50.156	TCP	60	80 ¡ú 63571 [ACK] Seq=567 Ack=942 Win=64239 Len=0
40	20.565306	180.163.228.250	192.168.50.156	TCP	60	80 ¡ú 63571 [FIN, PSH, ACK] Seq=567 Ack=942 Win=64239 Len=0
41	20.565361	192.168.50.156	180.163.228.250	TCP	54	63571 ¡ú 80 [ACK] Seq=942 Ack=568 Win=63674 Len=0
42	21.014190	192.168.50.152	192.168.50.156	TCP	60	2475 ¡ú 30 [SYN] Seq=0 Win=512 Len=0
43	22.014741	192.168.50.152	192.168.50.156	TCP	60	2476 ¡ú 31 [SYN] Seq=0 Win=512 Len=0
44	23.015830	192.168.50.152	192.168.50.156	TCP	60	2477 ¡ú 32 [SYN] Seq=0 Win=512 Len=0
45	23.991577	192.168.50.152	192.168.50.156	TCP	60	2478 ¡ú 33 [SYN] Seq=0 Win=512 Len=0
46	25.016898	192.168.50.152	192.168.50.156	TCP	60	2479 ¡ú 34 [SYN] Seq=0 Win=512 Len=0
47	26.017748	192.168.50.152	192.168.50.156	TCP	60	2480 ¡ú 35 [SYN] Seq=0 Win=512 Len=0
48	26.451884	192.168.50.156	1.192.136.133	UDP	86	10156 ¡ú 80 Len=44
49	27.018047	192.168.50.152	192.168.50.156	TCP	60	2481 ¡ú 36 [SYN] Seq=0 Win=512 Len=0
50	28.018482	192.168.50.152	192.168.50.156	TCP	60	2482 ¡ú 37 [SYN] Seq=0 Win=512 Len=0
51	28.673613	192.168.50.156	180.163.228.250	TCP	66	63582 ¡ú 80 [SYN, ECE, CWR] Seq=0 Win=8192 Len=0 MSS=1460 WS=256 SACK_PERM
52	28.680696	180.163.228.250	192.168.50.156	TCP	60	80 ¡ú 63582 [SYN, ACK] Seq=0 Ack=1 Win=64240 Len=0 MSS=1460
53	28.680754	192.168.50.156	180.163.228.250	TCP	54	63582 ¡ú 80 [ACK] Seq=1 Ack=1 Win=64240 Len=0
54	28.691606	192.168.50.156	180.163.228.250	TCP	336	63582 ¡ú 80 [PSH, ACK] Seq=1 Ack=1 Win=64240 Len=282 [TCP PDU reassembled in 56]
55	28.691854	180.163.228.250	192.168.50.156	TCP	60	80 ¡ú 63582 [ACK] Seq=1 Ack=283 Win=64240 Len=0
56	28.691871	192.168.50.156	180.163.228.250	HTTP	872	POST /cloudquery.php HTTP/1.1 
57	28.692026	180.163.228.250	192.168.50.156	TCP	60	80 ¡ú 63582 [ACK] Seq=1 Ack=1101 Win=64240 Len=0
58	28.732888	180.163.228.250	192.168.50.156	HTTP	620	HTTP/1.1 200 OK  (application/octet-stream)
59	28.733097	192.168.50.156	180.163.228.250	TCP	54	63582 ¡ú 80 [FIN, ACK] Seq=1101 Ack=567 Win=63674 Len=0
60	28.733244	180.163.228.250	192.168.50.156	TCP	60	80 ¡ú 63582 [ACK] Seq=567 Ack=1102 Win=64239 Len=0
61	28.739932	180.163.228.250	192.168.50.156	TCP	60	80 ¡ú 63582 [FIN, PSH, ACK] Seq=567 Ack=1102 Win=64239 Len=0
62	28.739967	192.168.50.156	180.163.228.250	TCP	54	63582 ¡ú 80 [ACK] Seq=1102 Ack=568 Win=63674 Len=0
63	29.004410	192.168.50.152	192.168.50.156	TCP	60	2483 ¡ú 38 [SYN] Seq=0 Win=512 Len=0
64	30.025473	192.168.50.152	192.168.50.156	TCP	60	2484 ¡ú 39 [SYN] Seq=0 Win=512 Len=0
65	30.104474	192.168.50.156	192.168.50.2	NBNS	110	Refresh NB WIN-JFF05G84TMV<20>
66	30.820179	192.168.50.156	180.163.228.250	TCP	66	63587 ¡ú 80 [SYN, ECE, CWR] Seq=0 Win=8192 Len=0 MSS=1460 WS=256 SACK_PERM
67	30.827440	180.163.228.250	192.168.50.156	TCP	60	80 ¡ú 63587 [SYN, ACK] Seq=0 Ack=1 Win=64240 Len=0 MSS=1460
68	30.827506	192.168.50.156	180.163.228.250	TCP	54	63587 ¡ú 80 [ACK] Seq=1 Ack=1 Win=64240 Len=0
69	30.837704	192.168.50.156	180.163.228.250	TCP	336	63587 ¡ú 80 [PSH, ACK] Seq=1 Ack=1 Win=64240 Len=282 [TCP PDU reassembled in 71]
70	30.837858	180.163.228.250	192.168.50.156	TCP	60	80 ¡ú 63587 [ACK] Seq=1 Ack=283 Win=64240 Len=0
71	30.837874	192.168.50.156	180.163.228.250	HTTP	848	POST /cloudquery.php HTTP/1.1 
72	30.838010	180.163.228.250	192.168.50.156	TCP	60	80 ¡ú 63587 [ACK] Seq=1 Ack=1077 Win=64240 Len=0
73	30.872998	180.163.228.250	192.168.50.156	HTTP	620	HTTP/1.1 200 OK  (application/octet-stream)
74	30.873194	192.168.50.156	180.163.228.250	TCP	54	63587 ¡ú 80 [FIN, ACK] Seq=1077 Ack=567 Win=63674 Len=0
75	30.873353	180.163.228.250	192.168.50.156	TCP	60	80 ¡ú 63587 [ACK] Seq=567 Ack=1078 Win=64239 Len=0
76	30.880865	180.163.228.250	192.168.50.156	TCP	60	80 ¡ú 63587 [FIN, PSH, ACK] Seq=567 Ack=1078 Win=64239 Len=0
77	30.880899	192.168.50.156	180.163.228.250	TCP	54	63587 ¡ú 80 [ACK] Seq=1078 Ack=568 Win=63674 Len=0
78	31.026065	192.168.50.152	192.168.50.156	TCP	60	2485 ¡ú 40 [SYN] Seq=0 Win=512 Len=0
79	31.622117	192.168.50.156	192.168.50.2	NBNS	110	Refresh NB WIN-JFF05G84TMV<20>
80	32.026967	192.168.50.152	192.168.50.156	TCP	60	2486 ¡ú 41 [SYN] Seq=0 Win=512 Len=0
81	33.027870	192.168.50.152	192.168.50.156	TCP	60	2487 ¡ú 42 [SYN] Seq=0 Win=512 Len=0
82	33.123540	192.168.50.156	192.168.50.2	NBNS	110	Refresh NB WIN-JFF05G84TMV<20>
83	34.028528	192.168.50.152	192.168.50.156	TCP	60	2488 ¡ú 43 [SYN] Seq=0 Win=512 Len=0
84	35.029072	192.168.50.152	192.168.50.156	TCP	60	2489 ¡ú 44 [SYN] Seq=0 Win=512 Len=0
85	36.029773	192.168.50.152	192.168.50.156	TCP	60	2490 ¡ú 45 [SYN] Seq=0 Win=512 Len=0
86	37.030691	192.168.50.152	192.168.50.156	TCP	60	2491 ¡ú 46 [SYN] Seq=0 Win=512 Len=0
87	38.031894	192.168.50.152	192.168.50.156	TCP	60	2492 ¡ú 47 [SYN] Seq=0 Win=512 Len=0
88	39.004817	192.168.50.156	180.163.228.250	TCP	66	63603 ¡ú 80 [SYN, ECE, CWR] Seq=0 Win=8192 Len=0 MSS=1460 WS=256 SACK_PERM
89	39.012113	180.163.228.250	192.168.50.156	TCP	60	80 ¡ú 63603 [SYN, ACK] Seq=0 Ack=1 Win=64240 Len=0 MSS=1460
90	39.012185	192.168.50.156	180.163.228.250	TCP	54	63603 ¡ú 80 [ACK] Seq=1 Ack=1 Win=64240 Len=0
91	39.012393	192.168.50.156	180.163.228.250	TCP	336	63603 ¡ú 80 [PSH, ACK] Seq=1 Ack=1 Win=64240 Len=282 [TCP PDU reassembled in 93]
92	39.012527	180.163.228.250	192.168.50.156	TCP	60	80 ¡ú 63603 [ACK] Seq=1 Ack=283 Win=64240 Len=0
93	39.012538	192.168.50.156	180.163.228.250	HTTP	968	POST /cloudquery.php HTTP/1.1 
94	39.012625	180.163.228.250	192.168.50.156	TCP	60	80 ¡ú 63603 [ACK] Seq=1 Ack=1197 Win=64240 Len=0
95	39.032144	192.168.50.152	192.168.50.156	TCP	60	2493 ¡ú 48 [SYN] Seq=0 Win=512 Len=0
96	39.052437	180.163.228.250	192.168.50.156	HTTP	620	HTTP/1.1 200 OK  (application/octet-stream)
97	39.052648	192.168.50.156	180.163.228.250	TCP	54	63603 ¡ú 80 [FIN, ACK] Seq=1197 Ack=567 Win=63674 Len=0
98	39.052783	180.163.228.250	192.168.50.156	TCP	60	80 ¡ú 63603 [ACK] Seq=567 Ack=1198 Win=64239 Len=0
99	39.058710	180.163.228.250	192.168.50.156	TCP	60	80 ¡ú 63603 [FIN, PSH, ACK] Seq=567 Ack=1198 Win=64239 Len=0
100	39.058750	192.168.50.156	180.163.228.250	TCP	54	63603 ¡ú 80 [ACK] Seq=1198 Ack=568 Win=63674 Len=0
101	39.126888	fe80::ffff:ffff:fffe	ff02::2	ICMPv6	103	Router Solicitation
102	39.371164	fe80::8000:f227:d7ae:87d3	fe80::ffff:ffff:fffe	ICMPv6	151	Router Advertisement
103	39.415750	fe80::ff1:580a:a163:a5c0	ff02::c	UDP/XML	718	60832 ¡ú 3702 Len=656
104	39.416096	192.168.50.1	239.255.255.250	UDP/XML	698	60831 ¡ú 3702 Len=656
105	39.603325	192.168.50.1	239.255.255.250	UDP/XML	698	60831 ¡ú 3702 Len=656
106	39.623270	fe80::ff1:580a:a163:a5c0	ff02::c	UDP/XML	718	60832 ¡ú 3702 Len=656
107	39.976176	192.168.50.1	239.255.255.250	UDP/XML	698	60831 ¡ú 3702 Len=656
108	40.033016	192.168.50.152	192.168.50.156	TCP	60	2494 ¡ú 49 [SYN] Seq=0 Win=512 Len=0
109	40.038108	fe80::ff1:580a:a163:a5c0	ff02::c	UDP/XML	718	60832 ¡ú 3702 Len=656
110	40.721117	192.168.50.1	239.255.255.250	UDP/XML	698	60831 ¡ú 3702 Len=656
111	40.866824	fe80::ff1:580a:a163:a5c0	ff02::c	UDP/XML	718	60832 ¡ú 3702 Len=656
112	41.034090	192.168.50.152	192.168.50.156	TCP	60	2495 ¡ú 50 [SYN] Seq=0 Win=512 Len=0
113	41.432837	VMware_7a:15:6b	VMware_bf:0a:c7	ARP	60	Who has 192.168.50.156? Tell 192.168.50.152
114	41.432853	VMware_bf:0a:c7	VMware_7a:15:6b	ARP	42	192.168.50.156 is at 00:0c:29:bf:0a:c7
115	42.034390	192.168.50.152	192.168.50.156	TCP	60	2496 ¡ú 51 [SYN] Seq=0 Win=512 Len=0
116	42.210022	192.168.50.1	239.255.255.250	UDP/XML	698	60831 ¡ú 3702 Len=656
117	42.522742	fe80::ff1:580a:a163:a5c0	ff02::c	UDP/XML	718	60832 ¡ú 3702 Len=656
118	43.035572	192.168.50.152	192.168.50.156	TCP	60	2497 ¡ú 52 [SYN] Seq=0 Win=512 Len=0
119	44.036005	192.168.50.152	192.168.50.156	TCP	60	2498 ¡ú 53 [SYN] Seq=0 Win=512 Len=0
120	44.036052	192.168.50.156	192.168.50.152	TCP	58	53 ¡ú 2498 [SYN, ACK] Seq=0 Ack=1 Win=8192 Len=0 MSS=1460
121	44.039042	192.168.50.152	192.168.50.156	TCP	60	2498 ¡ú 53 [RST] Seq=1 Win=0 Len=0
122	44.210454	192.168.50.1	239.255.255.250	UDP/XML	698	60831 ¡ú 3702 Len=656
123	44.522828	fe80::ff1:580a:a163:a5c0	ff02::c	UDP/XML	718	60832 ¡ú 3702 Len=656
124	45.036118	192.168.50.152	192.168.50.156	TCP	60	2499 ¡ú 54 [SYN] Seq=0 Win=512 Len=0
125	46.037157	192.168.50.152	192.168.50.156	TCP	60	2500 ¡ú 55 [SYN] Seq=0 Win=512 Len=0
126	46.210617	192.168.50.1	239.255.255.250	UDP/XML	698	60831 ¡ú 3702 Len=656
127	46.523827	fe80::ff1:580a:a163:a5c0	ff02::c	UDP/XML	718	60832 ¡ú 3702 Len=656
128	47.038159	192.168.50.152	192.168.50.156	TCP	60	2501 ¡ú 56 [SYN] Seq=0 Win=512 Len=0
129	48.038577	192.168.50.152	192.168.50.156	TCP	60	2502 ¡ú 57 [SYN] Seq=0 Win=512 Len=0
130	48.484904	192.168.50.156	180.163.252.201	TCP	55	[TCP Keep-Alive] 50075 ¡ú 80 [ACK] Seq=1 Ack=1 Win=63328 Len=1
131	48.485092	180.163.252.201	192.168.50.156	TCP	60	[TCP Keep-Alive ACK] 80 ¡ú 50075 [ACK] Seq=1 Ack=2 Win=64240 Len=0
132	49.039270	192.168.50.152	192.168.50.156	TCP	60	2503 ¡ú 58 [SYN] Seq=0 Win=512 Len=0
133	49.188494	192.168.50.156	180.163.228.250	TCP	66	63617 ¡ú 80 [SYN, ECE, CWR] Seq=0 Win=8192 Len=0 MSS=1460 WS=256 SACK_PERM
134	49.196682	180.163.228.250	192.168.50.156	TCP	60	80 ¡ú 63617 [SYN, ACK] Seq=0 Ack=1 Win=64240 Len=0 MSS=1460
135	49.196756	192.168.50.156	180.163.228.250	TCP	54	63617 ¡ú 80 [ACK] Seq=1 Ack=1 Win=64240 Len=0
136	49.206889	192.168.50.156	180.163.228.250	TCP	336	63617 ¡ú 80 [PSH, ACK] Seq=1 Ack=1 Win=64240 Len=282 [TCP PDU reassembled in 138]
137	49.207107	180.163.228.250	192.168.50.156	TCP	60	80 ¡ú 63617 [ACK] Seq=1 Ack=283 Win=64240 Len=0
138	49.207123	192.168.50.156	180.163.228.250	HTTP	968	POST /cloudquery.php HTTP/1.1 
139	49.207225	180.163.228.250	192.168.50.156	TCP	60	80 ¡ú 63617 [ACK] Seq=1 Ack=1197 Win=64240 Len=0
140	49.247525	180.163.228.250	192.168.50.156	HTTP	620	HTTP/1.1 200 OK  (application/octet-stream)
141	49.247734	192.168.50.156	180.163.228.250	TCP	54	63617 ¡ú 80 [FIN, ACK] Seq=1197 Ack=567 Win=63674 Len=0
142	49.247860	180.163.228.250	192.168.50.156	TCP	60	80 ¡ú 63617 [ACK] Seq=567 Ack=1198 Win=64239 Len=0
143	49.255602	180.163.228.250	192.168.50.156	TCP	60	80 ¡ú 63617 [FIN, PSH, ACK] Seq=567 Ack=1198 Win=64239 Len=0
144	49.255637	192.168.50.156	180.163.228.250	TCP	54	63617 ¡ú 80 [ACK] Seq=1198 Ack=568 Win=63674 Len=0
145	49.504128	192.168.50.156	36.99.172.6	DNS	81	Standard query 0xf0bd A s.f.360.cn OPT
146	49.530722	36.99.172.6	192.168.50.156	DNS	288	Standard query response 0xf0bd A s.f.360.cn CNAME s.f.qh-lb.com NS dns8.360safe.com NS dns9.360safe.com NS dns2.360safe.com NS dns1.360safe.com NS dns3.360safe.com NS dns7.360safe.com OPT
147	49.534450	192.168.50.156	106.63.24.180	DNS	84	Standard query 0xda4c A s.f.qh-lb.com OPT
148	49.535846	192.168.50.156	8.8.8.8	DNS	70	Standard query 0x4812 A s.f.360.cn
149	49.565750	106.63.24.180	192.168.50.156	DNS	105	Standard query response 0xda4c A s.f.qh-lb.com A 103.28.8.52 A 36.99.172.117
150	49.567234	192.168.50.156	103.28.8.52	TCP	66	63619 ¡ú 80 [SYN, ECE, CWR] Seq=0 Win=8192 Len=0 MSS=1460 WS=256 SACK_PERM
151	49.567775	8.8.8.8	192.168.50.156	DNS	129	Standard query response 0x4812 A s.f.360.cn CNAME s.f.qh-lb.com A 36.99.172.75 A 103.28.8.34
152	49.597564	103.28.8.52	192.168.50.156	TCP	60	80 ¡ú 63619 [SYN, ACK] Seq=0 Ack=1 Win=64240 Len=0 MSS=1460
153	49.597638	192.168.50.156	103.28.8.52	TCP	54	63619 ¡ú 80 [ACK] Seq=1 Ack=1 Win=64240 Len=0
154	49.597850	192.168.50.156	103.28.8.52	HTTP	953	POST /scan HTTP/1.1  (application/x-www-form-urlencoded)
155	49.598090	103.28.8.52	192.168.50.156	TCP	60	80 ¡ú 63619 [ACK] Seq=1 Ack=900 Win=64240 Len=0
156	49.629817	103.28.8.52	192.168.50.156	HTTP	327	HTTP/1.1 200 OK  (application/octet-stream)
157	49.630008	192.168.50.156	103.28.8.52	TCP	54	63619 ¡ú 80 [FIN, ACK] Seq=900 Ack=274 Win=63967 Len=0
158	49.630187	103.28.8.52	192.168.50.156	TCP	60	80 ¡ú 63619 [ACK] Seq=274 Ack=901 Win=64239 Len=0
159	49.660008	103.28.8.52	192.168.50.156	TCP	60	80 ¡ú 63619 [FIN, PSH, ACK] Seq=274 Ack=901 Win=64239 Len=0
160	49.660046	192.168.50.156	103.28.8.52	TCP	54	63619 ¡ú 80 [ACK] Seq=901 Ack=275 Win=63967 Len=0
161	50.039478	192.168.50.152	192.168.50.156	TCP	60	2504 ¡ú 59 [SYN] Seq=0 Win=512 Len=0
162	51.039803	192.168.50.152	192.168.50.156	TCP	60	2505 ¡ú 60 [SYN] Seq=0 Win=512 Len=0
163	52.040466	192.168.50.152	192.168.50.156	TCP	60	2506 ¡ú 61 [SYN] Seq=0 Win=512 Len=0
164	53.041368	192.168.50.152	192.168.50.156	TCP	60	2507 ¡ú 62 [SYN] Seq=0 Win=512 Len=0
165	54.042157	192.168.50.152	192.168.50.156	TCP	60	2508 ¡ú 63 [SYN] Seq=0 Win=512 Len=0
166	55.043003	192.168.50.152	192.168.50.156	TCP	60	2509 ¡ú 64 [SYN] Seq=0 Win=512 Len=0
167	56.043734	192.168.50.152	192.168.50.156	TCP	60	2510 ¡ú 65 [SYN] Seq=0 Win=512 Len=0
168	57.044378	192.168.50.152	192.168.50.156	TCP	60	2511 ¡ú 66 [SYN] Seq=0 Win=512 Len=0
169	58.045540	192.168.50.152	192.168.50.156	TCP	60	2512 ¡ú 67 [SYN] Seq=0 Win=512 Len=0
170	58.955858	180.163.243.139	192.168.50.156	TCP	1330	80 ¡ú 60009 [PSH, ACK] Seq=1 Ack=1 Win=64240 Len=1276
171	58.986130	192.168.50.156	180.163.243.139	TCP	70	60009 ¡ú 80 [PSH, ACK] Seq=1 Ack=1277 Win=64240 Len=16
172	58.986429	180.163.243.139	192.168.50.156	TCP	60	80 ¡ú 60009 [ACK] Seq=1277 Ack=17 Win=64240 Len=0
173	59.046664	192.168.50.152	192.168.50.156	TCP	60	2513 ¡ú 68 [SYN] Seq=0 Win=512 Len=0
174	59.371937	192.168.50.156	180.163.228.250	TCP	66	63641 ¡ú 80 [SYN, ECE, CWR] Seq=0 Win=8192 Len=0 MSS=1460 WS=256 SACK_PERM
175	59.379591	180.163.228.250	192.168.50.156	TCP	60	80 ¡ú 63641 [SYN, ACK] Seq=0 Ack=1 Win=64240 Len=0 MSS=1460
176	59.379661	192.168.50.156	180.163.228.250	TCP	54	63641 ¡ú 80 [ACK] Seq=1 Ack=1 Win=64240 Len=0
177	59.379848	192.168.50.156	180.163.228.250	TCP	336	63641 ¡ú 80 [PSH, ACK] Seq=1 Ack=1 Win=64240 Len=282 [TCP PDU reassembled in 179]
178	59.379980	180.163.228.250	192.168.50.156	TCP	60	80 ¡ú 63641 [ACK] Seq=1 Ack=283 Win=64240 Len=0
179	59.379990	192.168.50.156	180.163.228.250	HTTP	968	POST /cloudquery.php HTTP/1.1 
180	59.380084	180.163.228.250	192.168.50.156	TCP	60	80 ¡ú 63641 [ACK] Seq=1 Ack=1197 Win=64240 Len=0
181	59.419108	180.163.228.250	192.168.50.156	HTTP	620	HTTP/1.1 200 OK  (application/octet-stream)
182	59.419330	192.168.50.156	180.163.228.250	TCP	54	63641 ¡ú 80 [FIN, ACK] Seq=1197 Ack=567 Win=63674 Len=0
183	59.419463	180.163.228.250	192.168.50.156	TCP	60	80 ¡ú 63641 [ACK] Seq=567 Ack=1198 Win=64239 Len=0
184	59.424391	180.163.228.250	192.168.50.156	TCP	60	80 ¡ú 63641 [FIN, PSH, ACK] Seq=567 Ack=1198 Win=64239 Len=0
185	59.424427	192.168.50.156	180.163.228.250	TCP	54	63641 ¡ú 80 [ACK] Seq=1198 Ack=568 Win=63674 Len=0
186	59.448646	192.168.50.156	36.99.172.6	DNS	84	Standard query 0xe922 A pw.mediav.com OPT
187	59.470889	36.99.172.6	192.168.50.156	DNS	302	Standard query response 0xe922 A pw.mediav.com CNAME max-k8s.adsys.qihucdn.cn NS dns8.360safe.com NS dns9.360safe.com NS dns2.360safe.com NS dns1.360safe.com NS dns3.360safe.com NS dns7.360safe.com OPT
188	59.471268	192.168.50.156	203.119.29.1	DNS	95	Standard query 0xebe8 A max-k8s.adsys.qihucdn.cn OPT
189	59.478450	203.119.29.1	192.168.50.156	DNS	832	Standard query response 0xebe8 A max-k8s.adsys.qihucdn.cn NS dns1.360safe.com NS dns2.360safe.com NS dns3.360safe.com NS dns7.360safe.com NS dns8.360safe.com NS dns9.360safe.com NSEC3 RRSIG NSEC3 RRSIG OPT
190	59.478702	192.168.50.156	36.99.172.6	DNS	95	Standard query 0x5bdf A max-k8s.adsys.qihucdn.cn OPT
191	59.479821	192.168.50.156	8.8.8.8	DNS	73	Standard query 0x2ef3 A pw.mediav.com
192	59.503008	36.99.172.6	192.168.50.156	DNS	291	Standard query response 0x5bdf A max-k8s.adsys.qihucdn.cn A 180.163.247.45 NS dns8.360safe.com NS dns9.360safe.com NS dns2.360safe.com NS dns1.360safe.com NS dns3.360safe.com NS dns7.360safe.com OPT
193	59.508555	8.8.8.8	192.168.50.156	DNS	127	Standard query response 0x2ef3 A pw.mediav.com CNAME max-k8s.adsys.qihucdn.cn A 180.163.247.45
194	59.508934	192.168.50.156	180.163.247.45	TCP	66	63642 ¡ú 443 [SYN, ECE, CWR] Seq=0 Win=8192 Len=0 MSS=1460 WS=256 SACK_PERM
195	59.518029	180.163.247.45	192.168.50.156	TCP	60	443 ¡ú 63642 [SYN, ACK] Seq=0 Ack=1 Win=64240 Len=0 MSS=1460
196	59.518106	192.168.50.156	180.163.247.45	TCP	54	63642 ¡ú 443 [ACK] Seq=1 Ack=1 Win=64240 Len=0
197	59.561504	192.168.50.156	180.163.247.45	TLSv1.2	571	Client Hello (SNI=pw.mediav.com)
198	59.561879	180.163.247.45	192.168.50.156	TCP	60	443 ¡ú 63642 [ACK] Seq=1 Ack=518 Win=64240 Len=0
199	59.571190	180.163.247.45	192.168.50.156	TLSv1.2	1454	Server Hello
200	59.572136	180.163.247.45	192.168.50.156	TCP	1454	443 ¡ú 63642 [PSH, ACK] Seq=1401 Ack=518 Win=64240 Len=1400 [TCP PDU reassembled in 203]
201	59.572226	192.168.50.156	180.163.247.45	TCP	54	63642 ¡ú 443 [ACK] Seq=518 Ack=2801 Win=64240 Len=0
202	59.573522	180.163.247.45	192.168.50.156	TCP	1350	443 ¡ú 63642 [PSH, ACK] Seq=2801 Ack=518 Win=64240 Len=1296 [TCP PDU reassembled in 203]
203	59.573915	180.163.247.45	192.168.50.156	TLSv1.2	1176	Certificate, Server Key Exchange, Server Hello Done
204	59.573956	192.168.50.156	180.163.247.45	TCP	54	63642 ¡ú 443 [ACK] Seq=518 Ack=5219 Win=64240 Len=0
205	59.576595	192.168.50.156	180.163.247.45	TLSv1.2	180	Client Key Exchange, Change Cipher Spec, Encrypted Handshake Message
206	59.576704	180.163.247.45	192.168.50.156	TCP	60	443 ¡ú 63642 [ACK] Seq=5219 Ack=644 Win=64240 Len=0
207	59.583534	180.163.247.45	192.168.50.156	TLSv1.2	105	Change Cipher Spec, Encrypted Handshake Message
208	59.583794	192.168.50.156	180.163.247.45	TLSv1.2	287	Application Data
209	59.583901	180.163.247.45	192.168.50.156	TCP	60	443 ¡ú 63642 [ACK] Seq=5270 Ack=877 Win=64240 Len=0
210	59.591247	180.163.247.45	192.168.50.156	TLSv1.2	963	Application Data
211	59.591451	192.168.50.156	180.163.247.45	TLSv1.2	85	Encrypted Alert
212	59.591566	180.163.247.45	192.168.50.156	TCP	60	443 ¡ú 63642 [ACK] Seq=6179 Ack=908 Win=64240 Len=0
213	59.593109	192.168.50.156	180.163.247.45	TCP	54	63642 ¡ú 443 [FIN, ACK] Seq=908 Ack=6179 Win=63280 Len=0
214	59.593203	180.163.247.45	192.168.50.156	TCP	60	443 ¡ú 63642 [ACK] Seq=6179 Ack=909 Win=64239 Len=0
215	59.597961	180.163.247.45	192.168.50.156	TCP	60	443 ¡ú 63642 [FIN, PSH, ACK] Seq=6179 Ack=909 Win=64239 Len=0
216	59.597989	192.168.50.156	180.163.247.45	TCP	54	63642 ¡ú 443 [ACK] Seq=909 Ack=6180 Win=63280 Len=0
217	59.757292	180.163.243.139	192.168.50.156	TCP	1330	80 ¡ú 60009 [PSH, ACK] Seq=1277 Ack=17 Win=64240 Len=1276
218	59.757794	192.168.50.156	180.163.243.139	TCP	70	60009 ¡ú 80 [PSH, ACK] Seq=17 Ack=2553 Win=62964 Len=16
219	59.758020	180.163.243.139	192.168.50.156	TCP	60	80 ¡ú 60009 [ACK] Seq=2553 Ack=33 Win=64240 Len=0
220	60.046955	192.168.50.152	192.168.50.156	TCP	60	2514 ¡ú 69 [SYN] Seq=0 Win=512 Len=0
221	60.556238	180.163.243.139	192.168.50.156	TCP	1330	80 ¡ú 60009 [PSH, ACK] Seq=2553 Ack=33 Win=64240 Len=1276
222	60.556714	192.168.50.156	180.163.243.139	TCP	70	60009 ¡ú 80 [PSH, ACK] Seq=33 Ack=3829 Win=64240 Len=16
223	60.556934	180.163.243.139	192.168.50.156	TCP	60	80 ¡ú 60009 [ACK] Seq=3829 Ack=49 Win=64240 Len=0
224	60.562669	180.163.243.139	192.168.50.156	TCP	1330	80 ¡ú 60009 [PSH, ACK] Seq=3829 Ack=49 Win=64240 Len=1276
225	60.563232	192.168.50.156	180.163.243.139	TCP	70	60009 ¡ú 80 [PSH, ACK] Seq=49 Ack=5105 Win=62964 Len=16
226	60.563450	180.163.243.139	192.168.50.156	TCP	60	80 ¡ú 60009 [ACK] Seq=5105 Ack=65 Win=64240 Len=0
227	61.047322	192.168.50.152	192.168.50.156	TCP	60	2515 ¡ú 70 [SYN] Seq=0 Win=512 Len=0
228	62.047624	192.168.50.152	192.168.50.156	TCP	60	2516 ¡ú 71 [SYN] Seq=0 Win=512 Len=0
229	62.886652	192.168.50.1	239.255.255.250	SSDP	219	M-SEARCH * HTTP/1.1 
230	63.047818	192.168.50.152	192.168.50.156	TCP	60	2517 ¡ú 72 [SYN] Seq=0 Win=512 Len=0
231	63.886998	192.168.50.1	239.255.255.250	SSDP	219	M-SEARCH * HTTP/1.1 
232	64.048529	192.168.50.152	192.168.50.156	TCP	60	2518 ¡ú 73 [SYN] Seq=0 Win=512 Len=0
233	64.703406	fe80::ffff:ffff:fffe	ff02::2	ICMPv6	103	Router Solicitation
234	64.888003	192.168.50.1	239.255.255.250	SSDP	219	M-SEARCH * HTTP/1.1 
235	64.949303	fe80::8000:f227:d7ae:87d3	fe80::ffff:ffff:fffe	ICMPv6	151	Router Advertisement
236	65.049095	192.168.50.152	192.168.50.156	TCP	60	2519 ¡ú 74 [SYN] Seq=0 Win=512 Len=0
237	65.888658	192.168.50.1	239.255.255.250	SSDP	219	M-SEARCH * HTTP/1.1 
238	66.049858	192.168.50.152	192.168.50.156	TCP	60	2520 ¡ú 75 [SYN] Seq=0 Win=512 Len=0
239	67.050183	192.168.50.152	192.168.50.156	TCP	60	2521 ¡ú 76 [SYN] Seq=0 Win=512 Len=0
240	68.050676	192.168.50.152	192.168.50.156	TCP	60	2522 ¡ú 77 [SYN] Seq=0 Win=512 Len=0
241	69.051054	192.168.50.152	192.168.50.156	TCP	60	2523 ¡ú 78 [SYN] Seq=0 Win=512 Len=0
242	69.546571	192.168.50.156	180.163.228.250	TCP	66	63658 ¡ú 80 [SYN, ECE, CWR] Seq=0 Win=8192 Len=0 MSS=1460 WS=256 SACK_PERM
243	69.552710	180.163.228.250	192.168.50.156	TCP	60	80 ¡ú 63658 [SYN, ACK] Seq=0 Ack=1 Win=64240 Len=0 MSS=1460
244	69.553248	192.168.50.156	180.163.228.250	TCP	54	63658 ¡ú 80 [ACK] Seq=1 Ack=1 Win=64240 Len=0
245	69.564474	192.168.50.156	180.163.228.250	TCP	336	63658 ¡ú 80 [PSH, ACK] Seq=1 Ack=1 Win=64240 Len=282 [TCP PDU reassembled in 247]
246	69.564797	180.163.228.250	192.168.50.156	TCP	60	80 ¡ú 63658 [ACK] Seq=1 Ack=283 Win=64240 Len=0
247	69.564816	192.168.50.156	180.163.228.250	HTTP	968	POST /cloudquery.php HTTP/1.1 
248	69.564919	180.163.228.250	192.168.50.156	TCP	60	80 ¡ú 63658 [ACK] Seq=1 Ack=1197 Win=64240 Len=0
249	69.600517	180.163.228.250	192.168.50.156	HTTP	620	HTTP/1.1 200 OK  (application/octet-stream)
250	69.600730	192.168.50.156	180.163.228.250	TCP	54	63658 ¡ú 80 [FIN, ACK] Seq=1197 Ack=567 Win=63674 Len=0
251	69.600853	180.163.228.250	192.168.50.156	TCP	60	80 ¡ú 63658 [ACK] Seq=567 Ack=1198 Win=64239 Len=0
252	69.607190	180.163.228.250	192.168.50.156	TCP	60	80 ¡ú 63658 [FIN, PSH, ACK] Seq=567 Ack=1198 Win=64239 Len=0
253	69.607296	192.168.50.156	180.163.228.250	TCP	54	63658 ¡ú 80 [ACK] Seq=1198 Ack=568 Win=63674 Len=0
254	70.052355	192.168.50.152	192.168.50.156	TCP	60	2524 ¡ú 79 [SYN] Seq=0 Win=512 Len=0
255	71.052881	192.168.50.152	192.168.50.156	TCP	60	2525 ¡ú 80 [SYN] Seq=0 Win=512 Len=0
256	71.052957	192.168.50.156	192.168.50.152	TCP	58	80 ¡ú 2525 [SYN, ACK] Seq=0 Ack=1 Win=8192 Len=0 MSS=1460
257	71.053148	192.168.50.152	192.168.50.156	TCP	60	2525 ¡ú 80 [RST] Seq=1 Win=0 Len=0
