No.	Time	Source	Destination	Protocol	Length	Info
1	0	192.168.50.156	142.250.217.74	TCP	62	52931 → 443 [SYN] Seq=0 Win=8192 Len=0 MSS=1460 SACK_PERM
2	0.255318	192.168.50.156	142.250.217.74	TCP	62	52932 → 443 [SYN] Seq=0 Win=8192 Len=0 MSS=1460 SACK_PERM
3	2.260847	192.168.50.156	142.250.69.202	TCP	66	52952 → 443 [SYN, ECE, CWR] Seq=0 Win=8192 Len=0 MSS=1460 WS=256 SACK_PERM
4	2.751511	192.168.50.156	142.251.33.106	TCP	62	52937 → 443 [SYN] Seq=0 Win=8192 Len=0 MSS=1460 SACK_PERM
5	4.865752	192.168.50.156	142.251.33.74	TCP	66	52957 → 443 [SYN, ECE, CWR] Seq=0 Win=8192 Len=0 MSS=1460 WS=256 SACK_PERM
6	4.867581	142.250.33.106	192.168.50.156	TCP	60	54144 → 443 [SYN] Seq=0 Win=64240 Len=0 MSS=1460 WS=256 SACK_PERM
7	5.11924	142.250.33.106	192.168.50.156	TCP	60	54144 → 443 [SYN] Seq=0 Win=64240 Len=0 MSS=1460 WS=256 SACK_PERM
8	5.11956	192.168.50.156	142.251.33.74	TCP	66	52958 → 443 [SYN, ECE, CWR] Seq=0 Win=8192 Len=0 MSS=1460 WS=256 SACK_PERM
9	5.261297	192.168.50.156	142.250.69.202	TCP	66	[TCP Retransmission] 52952 → 443 [SYN, ECE, CWR] Seq=0 Win=8192 Len=0 MSS=1460 WS=256 SACK_PERM
10	7.866285	192.168.50.156	142.251.33.74	TCP	66	[TCP Retransmission] 52957 → 443 [SYN, ECE, CWR] Seq=0 Win=8192 Len=0 MSS=1460 WS=256 SACK_PERM
11	8.119334	192.168.50.156	142.251.33.74	TCP	66	[TCP Retransmission] 52958 → 443 [SYN, ECE, CWR] Seq=0 Win=8192 Len=0 MSS=1460 WS=256 SACK_PERM
12	11.261816	192.168.50.156	142.250.69.202	TCP	62	[TCP Retransmission] 52952 → 443 [SYN] Seq=0 Win=8192 Len=0 MSS=1460 SACK_PERM
13	12.000266	192.168.50.156	142.251.33.106	TCP	66	52973 → 443 [SYN, ECE, CWR] Seq=0 Win=8192 Len=0 MSS=1460 WS=256 SACK_PERM
14	12.002978	142.250.217.74	192.168.50.156	TCP	66	54132 → 80 [SYN] Seq=0 Win=64240 Len=0 MSS=1460 WS=256 SACK_PERM
15	12.255179	142.250.217.74	192.168.50.156	TCP	66	54132 → 80 [SYN] Seq=0 Win=64240 Len=0 MSS=1460 WS=256 SACK_PERM
16	12.255511	192.168.50.156	142.251.33.106	TCP	66	52975 → 443 [SYN, ECE, CWR] Seq=0 Win=8192 Len=0 MSS=1460 WS=256 SACK_PERM
17	12.262284	192.168.50.156	142.250.69.202	TCP	66	52976 → 443 [SYN, ECE, CWR] Seq=0 Win=8192 Len=0 MSS=1460 WS=256 SACK_PERM
18	13.867144	192.168.50.156	142.251.33.74	TCP	62	[TCP Retransmission] 52957 → 443 [SYN] Seq=0 Win=8192 Len=0 MSS=1460 SACK_PERM
19	14.120387	192.168.50.156	142.251.33.74	TCP	62	[TCP Retransmission] 52958 → 443 [SYN] Seq=0 Win=8192 Len=0 MSS=1460 SACK_PERM
20	14.752755	192.168.50.156	142.251.33.74	TCP	66	52980 → 443 [SYN, ECE, CWR] Seq=0 Win=8192 Len=0 MSS=1460 WS=256 SACK_PERM
21	14.754909	142.250.33.106	192.168.50.156	TCP	60	54144 → 443 [SYN] Seq=0 Win=64240 Len=0 MSS=1460 WS=256 SACK_PERM
22	15.000769	192.168.50.156	142.251.33.106	TCP	66	[TCP Retransmission] 52973 → 443 [SYN, ECE, CWR] Seq=0 Win=8192 Len=0 MSS=1460 WS=256 SACK_PERM
23	15.256251	192.168.50.156	142.251.33.106	TCP	66	[TCP Retransmission] 52975 → 443 [SYN, ECE, CWR] Seq=0 Win=8192 Len=0 MSS=1460 WS=256 SACK_PERM
24	15.262545	192.168.50.156	142.250.69.202	TCP	66	[TCP Retransmission] 52976 → 443 [SYN, ECE, CWR] Seq=0 Win=8192 Len=0 MSS=1460 WS=256 SACK_PERM
25	17.751817	192.168.50.156	142.251.33.74	TCP	66	[TCP Retransmission] 52980 → 443 [SYN, ECE, CWR] Seq=0 Win=8192 Len=0 MSS=1460 WS=256 SACK_PERM
26	21.000529	192.168.50.156	142.251.33.106	TCP	62	[TCP Retransmission] 52973 → 443 [SYN] Seq=0 Win=8192 Len=0 MSS=1460 SACK_PERM
27	21.257852	192.168.50.156	142.251.33.106	TCP	62	[TCP Retransmission] 52975 → 443 [SYN] Seq=0 Win=8192 Len=0 MSS=1460 SACK_PERM
28	21.262855	192.168.50.156	142.250.69.202	TCP	62	[TCP Retransmission] 52976 → 443 [SYN] Seq=0 Win=8192 Len=0 MSS=1460 SACK_PERM
29	23.261798	192.168.50.156	142.251.33.106	TCP	66	52992 → 443 [SYN, ECE, CWR] Seq=0 Win=8192 Len=0 MSS=1460 WS=256 SACK_PERM
30	23.263423	142.250.69.202	192.168.50.156	TCP	66	54132 → 80 [SYN] Seq=0 Win=64240 Len=0 MSS=1460 WS=256 SACK_PERM
31	23.752538	192.168.50.156	142.251.33.74	TCP	62	[TCP Retransmission] 52980 → 443 [SYN] Seq=0 Win=8192 Len=0 MSS=1460 SACK_PERM
32	24.21796	192.168.50.156	192.168.50.152	TCP	66	52995 → 80 [SYN, ECE, CWR] Seq=0 Win=8192 Len=0 MSS=1460 WS=256 SACK_PERM
33	24.218407	192.168.50.152	192.168.50.156	TCP	66	80 → 52995 [SYN, ACK] Seq=0 Ack=1 Win=29200 Len=0 MSS=1460 SACK_PERM WS=128
34	24.218475	192.168.50.156	192.168.50.152	TCP	54	52995 → 80 [ACK] Seq=1 Ack=1 Win=525568 Len=0
35	24.218771	192.168.50.156	192.168.50.152	HTTP	1307	GET /api/health/ HTTP/1.1 
36	24.219191	192.168.50.152	192.168.50.156	TCP	60	80 → 52995 [ACK] Seq=1 Ack=1254 Win=32128 Len=0
37	24.237569	192.168.50.152	192.168.50.156	HTTP/JSON	713	HTTP/1.1 200 OK , JSON (application/json)
38	24.288803	192.168.50.156	192.168.50.152	TCP	54	52995 → 80 [ACK] Seq=1254 Ack=660 Win=524800 Len=0
39	25.8675	192.168.50.156	142.250.217.74	TCP	66	52998 → 443 [SYN, ECE, CWR] Seq=0 Win=8192 Len=0 MSS=1460 WS=256 SACK_PERM
40	25.868269	142.250.33.74	192.168.50.156	TCP	60	54144 → 443 [SYN] Seq=0 Win=64240 Len=0 MSS=1460 WS=256 SACK_PERM
41	26.121963	192.168.50.156	142.250.217.74	TCP	66	53001 → 443 [SYN, ECE, CWR] Seq=0 Win=8192 Len=0 MSS=1460 WS=256 SACK_PERM
42	26.122567	142.250.33.74	192.168.50.156	TCP	60	54144 → 443 [SYN] Seq=0 Win=64240 Len=0 MSS=1460 WS=256 SACK_PERM
43	26.262169	192.168.50.156	142.251.33.106	TCP	66	[TCP Retransmission] 52992 → 443 [SYN, ECE, CWR] Seq=0 Win=8192 Len=0 MSS=1460 WS=256 SACK_PERM
44	26.300847	142.250.217.74	192.168.50.156	TCP	66	54132 → 80 [SYN] Seq=0 Win=64240 Len=0 MSS=1460 WS=256 SACK_PERM
45	26.301429	192.168.50.156	112.65.210.102	TCP	70	50200 → 80 [PSH, ACK] Seq=1 Ack=1277 Win=62964 Len=16
46	26.301735	142.250.217.74	192.168.50.156	TCP	66	54133 → 80 [SYN] Seq=0 Win=64240 Len=0 MSS=1460 WS=256 SACK_PERM
47	26.392779	192.168.50.156	180.163.221.140	TCP	66	53002 → 80 [SYN, ECE, CWR] Seq=0 Win=8192 Len=0 MSS=1460 WS=256 SACK_PERM
48	26.400394	180.163.221.140	192.168.50.156	TCP	60	80 → 53002 [SYN, ACK] Seq=0 Ack=1 Win=64240 Len=0 MSS=1460
49	26.400514	192.168.50.156	180.163.221.140	TCP	54	53002 → 80 [ACK] Seq=1 Ack=1 Win=64240 Len=0
50	26.40079	192.168.50.156	180.163.221.140	TCP	336	53002 → 80 [PSH, ACK] Seq=1 Ack=1 Win=64240 Len=282 [TCP PDU reassembled in 52]
51	26.40102	180.163.221.140	192.168.50.156	TCP	60	80 → 53002 [ACK] Seq=1 Ack=283 Win=64240 Len=0
52	26.401036	192.168.50.156	180.163.221.140	HTTP	768	POST /cloudquery.php HTTP/1.1 
53	26.401258	180.163.221.140	192.168.50.156	TCP	60	80 → 53002 [ACK] Seq=1 Ack=997 Win=64240 Len=0
54	26.429148	180.163.221.140	192.168.50.156	HTTP	432	HTTP/1.1 200 OK  (application/octet-stream)
55	26.429438	192.168.50.156	180.163.221.140	TCP	54	53002 → 80 [FIN, ACK] Seq=997 Ack=379 Win=63862 Len=0
56	26.429647	180.163.221.140	192.168.50.156	TCP	60	80 → 53002 [ACK] Seq=379 Ack=998 Win=64239 Len=0
57	26.435953	180.163.221.140	192.168.50.156	TCP	60	80 → 53002 [FIN, PSH, ACK] Seq=379 Ack=998 Win=64239 Len=0
58	26.435995	192.168.50.156	180.163.221.140	TCP	54	53002 → 80 [ACK] Seq=998 Ack=380 Win=63862 Len=0
59	28.049211	192.168.50.156	192.168.50.152	TCP	54	52995 → 80 [FIN, ACK] Seq=1254 Ack=660 Win=524800 Len=0
60	28.049638	192.168.50.152	192.168.50.156	TCP	60	80 → 52995 [FIN, ACK] Seq=660 Ack=1255 Win=32128 Len=0
61	28.049669	192.168.50.156	192.168.50.152	TCP	54	52995 → 80 [ACK] Seq=1255 Ack=661 Win=524800 Len=0
62	28.703252	142.250.217.74	192.168.50.156	TCP	66	54134 → 80 [SYN] Seq=0 Win=64240 Len=0 MSS=1460 WS=256 SACK_PERM
63	28.711851	192.168.50.156	112.65.210.102	TCP	70	50200 → 80 [PSH, ACK] Seq=17 Ack=2553 Win=64240 Len=16
64	28.712217	142.250.217.74	192.168.50.156	TCP	66	54135 → 80 [SYN] Seq=0 Win=64240 Len=0 MSS=1460 WS=256 SACK_PERM
65	28.868291	192.168.50.156	142.250.217.74	TCP	66	[TCP Retransmission] 52998 → 443 [SYN, ECE, CWR] Seq=0 Win=8192 Len=0 MSS=1460 WS=256 SACK_PERM
66	29.122366	192.168.50.156	142.250.217.74	TCP	66	[TCP Retransmission] 53001 → 443 [SYN, ECE, CWR] Seq=0 Win=8192 Len=0 MSS=1460 WS=256 SACK_PERM
67	32.261823	192.168.50.156	142.251.33.106	TCP	62	[TCP Retransmission] 52992 → 443 [SYN] Seq=0 Win=8192 Len=0 MSS=1460 SACK_PERM
68	32.608812	192.168.50.156	180.163.221.140	TCP	66	53011 → 80 [SYN, ECE, CWR] Seq=0 Win=8192 Len=0 MSS=1460 WS=256 SACK_PERM
69	32.62021	180.163.221.140	192.168.50.156	TCP	60	80 → 53011 [SYN, ACK] Seq=0 Ack=1 Win=64240 Len=0 MSS=1460
70	32.620357	192.168.50.156	180.163.221.140	TCP	54	53011 → 80 [ACK] Seq=1 Ack=1 Win=64240 Len=0
71	32.62084	192.168.50.156	180.163.221.140	TCP	336	53011 → 80 [PSH, ACK] Seq=1 Ack=1 Win=64240 Len=282 [TCP PDU reassembled in 73]
72	32.621226	180.163.221.140	192.168.50.156	TCP	60	80 → 53011 [ACK] Seq=1 Ack=283 Win=64240 Len=0
73	32.621856	192.168.50.156	180.163.221.140	HTTP	768	POST /cloudquery.php HTTP/1.1 
74	32.622096	180.163.221.140	192.168.50.156	TCP	60	80 → 53011 [ACK] Seq=1 Ack=997 Win=64240 Len=0
75	32.656375	180.163.221.140	192.168.50.156	HTTP	432	HTTP/1.1 200 OK  (application/octet-stream)
76	32.656705	192.168.50.156	180.163.221.140	TCP	54	53011 → 80 [FIN, ACK] Seq=997 Ack=379 Win=63862 Len=0
77	32.656878	180.163.221.140	192.168.50.156	TCP	60	80 → 53011 [ACK] Seq=379 Ack=998 Win=64239 Len=0
78	32.662108	180.163.221.140	192.168.50.156	TCP	60	80 → 53011 [FIN, PSH, ACK] Seq=379 Ack=998 Win=64239 Len=0
79	32.662145	192.168.50.156	180.163.221.140	TCP	54	53011 → 80 [ACK] Seq=998 Ack=380 Win=63862 Len=0
80	33.001251	192.168.50.156	142.250.69.202	TCP	66	53013 → 443 [SYN, ECE, CWR] Seq=0 Win=8192 Len=0 MSS=1460 WS=256 SACK_PERM
81	33.004822	142.250.33.106	192.168.50.156	TCP	60	54144 → 443 [SYN] Seq=0 Win=64240 Len=0 MSS=1460 WS=256 SACK_PERM
82	33.257643	142.250.33.106	192.168.50.156	TCP	60	54144 → 443 [SYN] Seq=0 Win=64240 Len=0 MSS=1460 WS=256 SACK_PERM
83	33.258047	192.168.50.156	142.250.69.202	TCP	66	53014 → 443 [SYN, ECE, CWR] Seq=0 Win=8192 Len=0 MSS=1460 WS=256 SACK_PERM
84	33.262987	192.168.50.156	142.251.33.106	TCP	66	53015 → 443 [SYN, ECE, CWR] Seq=0 Win=8192 Len=0 MSS=1460 WS=256 SACK_PERM
85	33.270528	142.250.69.202	192.168.50.156	TCP	60	53144 → 443 [SYN] Seq=0 Win=64240 Len=0 MSS=1460 WS=256 SACK_PERM
86	33.501056	142.250.217.74	192.168.50.156	TCP	66	54138 → 80 [SYN] Seq=0 Win=64240 Len=0 MSS=1460 WS=256 SACK_PERM
87	33.501519	192.168.50.156	112.65.210.102	TCP	70	50200 → 80 [PSH, ACK] Seq=33 Ack=3829 Win=62964 Len=16
88	33.501708	142.250.217.74	192.168.50.156	TCP	66	54132 → 80 [SYN] Seq=0 Win=64240 Len=0 MSS=1460 WS=256 SACK_PERM
89	34.868465	192.168.50.156	142.250.217.74	TCP	62	[TCP Retransmission] 52998 → 443 [SYN] Seq=0 Win=8192 Len=0 MSS=1460 SACK_PERM
90	35.122864	192.168.50.156	142.250.217.74	TCP	62	[TCP Retransmission] 53001 → 443 [SYN] Seq=0 Win=8192 Len=0 MSS=1460 SACK_PERM
91	35.753417	192.168.50.156	142.250.217.74	TCP	66	53020 → 443 [SYN, ECE, CWR] Seq=0 Win=8192 Len=0 MSS=1460 WS=256 SACK_PERM
92	35.754128	142.250.33.74	192.168.50.156	TCP	60	54144 → 443 [SYN] Seq=0 Win=64240 Len=0 MSS=1460 WS=256 SACK_PERM
93	36.002634	192.168.50.156	142.250.69.202	TCP	66	[TCP Retransmission] 53013 → 443 [SYN, ECE, CWR] Seq=0 Win=8192 Len=0 MSS=1460 WS=256 SACK_PERM
94	36.257891	192.168.50.156	142.250.69.202	TCP	66	[TCP Retransmission] 53014 → 443 [SYN, ECE, CWR] Seq=0 Win=8192 Len=0 MSS=1460 WS=256 SACK_PERM
95	36.262756	192.168.50.156	142.251.33.106	TCP	66	[TCP Retransmission] 53015 → 443 [SYN, ECE, CWR] Seq=0 Win=8192 Len=0 MSS=1460 WS=256 SACK_PERM
96	38.753253	192.168.50.156	142.250.217.74	TCP	66	[TCP Retransmission] 53020 → 443 [SYN, ECE, CWR] Seq=0 Win=8192 Len=0 MSS=1460 WS=256 SACK_PERM
97	40.183963	192.168.50.156	180.163.252.201	TCP	55	49742 → 80 [ACK] Seq=1 Ack=1 Win=63776 Len=1
98	40.184147	180.163.252.201	192.168.50.156	TCP	60	80 → 49742 [ACK] Seq=1 Ack=2 Win=64240 Len=0
99	40.717529	142.250.217.74	192.168.50.156	TCP	66	54132 → 80 [SYN] Seq=0 Win=64240 Len=0 MSS=1460 WS=256 SACK_PERM
100	40.717994	192.168.50.156	112.65.210.102	TCP	70	50200 → 80 [PSH, ACK] Seq=49 Ack=5105 Win=64240 Len=16
101	40.718176	142.250.217.74	192.168.50.156	TCP	66	54132 → 80 [SYN] Seq=0 Win=64240 Len=0 MSS=1460 WS=256 SACK_PERM
102	40.71967	142.250.217.74	192.168.50.156	TCP	66	54132 → 80 [SYN] Seq=0 Win=64240 Len=0 MSS=1460 WS=256 SACK_PERM
103	40.72003	192.168.50.156	112.65.210.102	TCP	70	50200 → 80 [PSH, ACK] Seq=65 Ack=6505 Win=62840 Len=16
104	40.720139	142.250.217.74	192.168.50.156	TCP	66	54132 → 80 [SYN] Seq=0 Win=64240 Len=0 MSS=1460 WS=256 SACK_PERM
105	40.729368	142.250.217.74	192.168.50.156	TCP	66	54132 → 80 [SYN] Seq=0 Win=64240 Len=0 MSS=1460 WS=256 SACK_PERM
106	40.729816	192.168.50.156	112.65.210.102	TCP	70	50200 → 80 [PSH, ACK] Seq=81 Ack=7657 Win=64240 Len=16
107	40.729983	142.250.217.74	192.168.50.156	TCP	66	54132 → 80 [SYN] Seq=0 Win=64240 Len=0 MSS=1460 WS=256 SACK_PERM
108	41.508082	142.250.217.74	192.168.50.156	TCP	66	54133 → 80 [SYN] Seq=0 Win=64240 Len=0 MSS=1460 WS=256 SACK_PERM
109	41.508539	192.168.50.156	112.65.210.102	TCP	70	50200 → 80 [PSH, ACK] Seq=97 Ack=8933 Win=62964 Len=16
110	41.508709	142.250.217.74	192.168.50.156	TCP	66	54134 → 80 [SYN] Seq=0 Win=64240 Len=0 MSS=1460 WS=256 SACK_PERM
111	42.002996	192.168.50.156	142.250.69.202	TCP	62	[TCP Retransmission] 53013 → 443 [SYN] Seq=0 Win=8192 Len=0 MSS=1460 SACK_PERM
112	42.258206	192.168.50.156	142.250.69.202	TCP	62	[TCP Retransmission] 53014 → 443 [SYN] Seq=0 Win=8192 Len=0 MSS=1460 SACK_PERM
113	42.262783	192.168.50.156	142.251.33.106	TCP	62	[TCP Retransmission] 53015 → 443 [SYN] Seq=0 Win=8192 Len=0 MSS=1460 SACK_PERM
114	42.365758	192.168.50.156	142.251.215.234	TCP	66	53040 → 443 [SYN, ECE, CWR] Seq=0 Win=8192 Len=0 MSS=1460 WS=256 SACK_PERM
115	44.262093	142.250.33.106	192.168.50.156	TCP	60	54144 → 443 [SYN] Seq=0 Win=64240 Len=0 MSS=1460 WS=256 SACK_PERM
116	44.262326	192.168.50.156	142.251.33.74	TCP	66	53043 → 443 [SYN, ECE, CWR] Seq=0 Win=8192 Len=0 MSS=1460 WS=256 SACK_PERM
117	44.754743	192.168.50.156	142.250.217.74	TCP	62	[TCP Retransmission] 53020 → 443 [SYN] Seq=0 Win=8192 Len=0 MSS=1460 SACK_PERM
118	45.365984	192.168.50.156	142.251.215.234	TCP	66	[TCP Retransmission] 53040 → 443 [SYN, ECE, CWR] Seq=0 Win=8192 Len=0 MSS=1460 WS=256 SACK_PERM
119	46.869155	142.250.217.74	192.168.50.156	TCP	66	54132 → 80 [SYN] Seq=0 Win=64240 Len=0 MSS=1460 WS=256 SACK_PERM
120	46.869432	192.168.50.156	142.250.217.106	TCP	66	53048 → 443 [SYN, ECE, CWR] Seq=0 Win=8192 Len=0 MSS=1460 WS=256 SACK_PERM
121	47.123409	192.168.50.156	142.250.217.106	TCP	66	53049 → 443 [SYN, ECE, CWR] Seq=0 Win=8192 Len=0 MSS=1460 WS=256 SACK_PERM
122	47.124039	142.250.217.74	192.168.50.156	TCP	66	54132 → 80 [SYN] Seq=0 Win=64240 Len=0 MSS=1460 WS=256 SACK_PERM
123	47.263633	192.168.50.156	142.251.33.74	TCP	66	[TCP Retransmission] 53043 → 443 [SYN, ECE, CWR] Seq=0 Win=8192 Len=0 MSS=1460 WS=256 SACK_PERM
124	49.869927	192.168.50.156	142.250.217.106	TCP	66	[TCP Retransmission] 53048 → 443 [SYN, ECE, CWR] Seq=0 Win=8192 Len=0 MSS=1460 WS=256 SACK_PERM
125	50.123746	192.168.50.156	142.250.217.106	TCP	66	[TCP Retransmission] 53049 → 443 [SYN, ECE, CWR] Seq=0 Win=8192 Len=0 MSS=1460 WS=256 SACK_PERM
126	51.36605	192.168.50.156	142.251.215.234	TCP	62	[TCP Retransmission] 53040 → 443 [SYN] Seq=0 Win=8192 Len=0 MSS=1460 SACK_PERM
127	53.264879	192.168.50.156	142.251.33.74	TCP	62	[TCP Retransmission] 53043 → 443 [SYN] Seq=0 Win=8192 Len=0 MSS=1460 SACK_PERM
128	54.005941	142.250.69.202	192.168.50.156	TCP	60	52124 → 443 [SYN] Seq=0 Win=64240 Len=0 MSS=1460 WS=256 SACK_PERM
129	54.217805	192.168.50.156	192.168.50.152	TCP	66	53059 → 80 [SYN, ECE, CWR] Seq=0 Win=8192 Len=0 MSS=1460 WS=256 SACK_PERM
130	54.218053	192.168.50.152	192.168.50.156	TCP	66	80 → 53059 [SYN, ACK] Seq=0 Ack=1 Win=29200 Len=0 MSS=1460 SACK_PERM WS=128
131	54.218109	192.168.50.156	192.168.50.152	TCP	54	53059 → 80 [ACK] Seq=1 Ack=1 Win=525568 Len=0
132	54.218377	192.168.50.156	192.168.50.152	HTTP	1307	GET /api/health/ HTTP/1.1 
133	54.218511	192.168.50.152	192.168.50.156	TCP	60	80 → 53059 [ACK] Seq=1 Ack=1254 Win=32128 Len=0
134	54.232526	192.168.50.152	192.168.50.156	HTTP/JSON	712	HTTP/1.1 200 OK , JSON (application/json)
135	54.25937	142.250.69.202	192.168.50.156	TCP	60	54144 → 443 [SYN] Seq=0 Win=64240 Len=0 MSS=1460 WS=256 SACK_PERM
136	54.263445	192.168.50.156	142.251.33.74	TCP	66	53060 → 443 [SYN, ECE, CWR] Seq=0 Win=8192 Len=0 MSS=1460 WS=256 SACK_PERM
137	54.26621	142.250.33.106	192.168.50.156	TCP	60	54144 → 443 [SYN] Seq=0 Win=64240 Len=0 MSS=1460 WS=256 SACK_PERM
138	54.283139	192.168.50.156	192.168.50.152	TCP	54	53059 → 80 [ACK] Seq=1254 Ack=659 Win=524800 Len=0
139	55.869515	192.168.50.156	142.250.217.106	TCP	62	[TCP Retransmission] 53048 → 443 [SYN] Seq=0 Win=8192 Len=0 MSS=1460 SACK_PERM
140	56.124334	192.168.50.156	142.250.217.106	TCP	62	[TCP Retransmission] 53049 → 443 [SYN] Seq=0 Win=8192 Len=0 MSS=1460 SACK_PERM
141	56.755024	192.168.50.156	142.250.217.106	TCP	66	53064 → 443 [SYN, ECE, CWR] Seq=0 Win=8192 Len=0 MSS=1460 WS=256 SACK_PERM
142	56.756659	142.250.217.74	192.168.50.156	TCP	66	54132 → 80 [SYN] Seq=0 Win=64240 Len=0 MSS=1460 WS=256 SACK_PERM
143	57.264284	192.168.50.156	142.251.33.74	TCP	66	[TCP Retransmission] 53060 → 443 [SYN, ECE, CWR] Seq=0 Win=8192 Len=0 MSS=1460 WS=256 SACK_PERM
144	58.056244	192.168.50.156	192.168.50.152	TCP	54	53059 → 80 [FIN, ACK] Seq=1254 Ack=659 Win=524800 Len=0
145	58.056546	192.168.50.152	192.168.50.156	TCP	60	80 → 53059 [FIN, ACK] Seq=659 Ack=1255 Win=32128 Len=0
146	58.056575	192.168.50.156	192.168.50.152	TCP	54	53059 → 80 [ACK] Seq=1255 Ack=660 Win=524800 Len=0
147	59.754975	192.168.50.156	142.250.217.106	TCP	66	[TCP Retransmission] 53064 → 443 [SYN, ECE, CWR] Seq=0 Win=8192 Len=0 MSS=1460 WS=256 SACK_PERM
148	62.986906	192.168.50.156	142.250.217.106	TCP	66	53077 → 443 [SYN, ECE, CWR] Seq=0 Win=8192 Len=0 MSS=1460 WS=256 SACK_PERM
149	63.239369	192.168.50.156	142.250.217.106	TCP	66	53078 → 443 [SYN, ECE, CWR] Seq=0 Win=8192 Len=0 MSS=1460 WS=256 SACK_PERM
150	63.265125	192.168.50.156	142.251.33.74	TCP	62	[TCP Retransmission] 53060 → 443 [SYN] Seq=0 Win=8192 Len=0 MSS=1460 SACK_PERM
151	63.365811	192.168.50.156	142.251.33.106	TCP	66	53079 → 443 [SYN, ECE, CWR] Seq=0 Win=8192 Len=0 MSS=1460 WS=256 SACK_PERM
152	63.370299	142.250.217.74	192.168.50.156	TCP	60	54144 → 443 [SYN] Seq=0 Win=64240 Len=0 MSS=1460 WS=256 SACK_PERM
153	65.265461	142.250.33.74	192.168.50.156	TCP	60	54144 → 443 [SYN] Seq=0 Win=64240 Len=0 MSS=1460 WS=256 SACK_PERM
154	65.265715	192.168.50.156	142.250.217.74	TCP	66	53083 → 443 [SYN, ECE, CWR] Seq=0 Win=8192 Len=0 MSS=1460 WS=256 SACK_PERM
155	65.754609	192.168.50.156	142.250.217.106	TCP	62	[TCP Retransmission] 53064 → 443 [SYN] Seq=0 Win=8192 Len=0 MSS=1460 SACK_PERM
156	65.987015	192.168.50.156	142.250.217.106	TCP	66	[TCP Retransmission] 53077 → 443 [SYN, ECE, CWR] Seq=0 Win=8192 Len=0 MSS=1460 WS=256 SACK_PERM
157	66.239942	192.168.50.156	142.250.217.106	TCP	66	[TCP Retransmission] 53078 → 443 [SYN, ECE, CWR] Seq=0 Win=8192 Len=0 MSS=1460 WS=256 SACK_PERM
158	66.366421	192.168.50.156	142.251.33.106	TCP	66	[TCP Retransmission] 53079 → 443 [SYN, ECE, CWR] Seq=0 Win=8192 Len=0 MSS=1460 WS=256 SACK_PERM
159	67.870258	192.168.50.156	142.251.215.234	TCP	66	53090 → 443 [SYN, ECE, CWR] Seq=0 Win=8192 Len=0 MSS=1460 WS=256 SACK_PERM
160	67.873067	142.250.217.74	192.168.50.156	TCP	66	54135 → 80 [SYN] Seq=0 Win=64240 Len=0 MSS=1460 WS=256 SACK_PERM
161	68.126786	192.168.50.156	142.251.215.234	TCP	66	53093 → 443 [SYN, ECE, CWR] Seq=0 Win=8192 Len=0 MSS=1460 WS=256 SACK_PERM
162	68.127521	142.250.217.74	192.168.50.156	TCP	66	54132 → 80 [SYN] Seq=0 Win=64240 Len=0 MSS=1460 WS=256 SACK_PERM
163	68.265698	192.168.50.156	142.250.217.74	TCP	66	[TCP Retransmission] 53083 → 443 [SYN, ECE, CWR] Seq=0 Win=8192 Len=0 MSS=1460 WS=256 SACK_PERM
164	70.871518	192.168.50.156	142.251.215.234	TCP	66	[TCP Retransmission] 53090 → 443 [SYN, ECE, CWR] Seq=0 Win=8192 Len=0 MSS=1460 WS=256 SACK_PERM
165	71.127088	192.168.50.156	142.251.215.234	TCP	66	[TCP Retransmission] 53093 → 443 [SYN, ECE, CWR] Seq=0 Win=8192 Len=0 MSS=1460 WS=256 SACK_PERM
166	71.987388	192.168.50.156	142.250.217.106	TCP	62	[TCP Retransmission] 53077 → 443 [SYN] Seq=0 Win=8192 Len=0 MSS=1460 SACK_PERM
167	72.239624	192.168.50.156	142.250.217.106	TCP	62	[TCP Retransmission] 53078 → 443 [SYN] Seq=0 Win=8192 Len=0 MSS=1460 SACK_PERM
168	72.367223	192.168.50.156	142.251.33.106	TCP	62	[TCP Retransmission] 53079 → 443 [SYN] Seq=0 Win=8192 Len=0 MSS=1460 SACK_PERM
169	74.267224	192.168.50.156	142.250.217.74	TCP	62	[TCP Retransmission] 53083 → 443 [SYN] Seq=0 Win=8192 Len=0 MSS=1460 SACK_PERM
170	75.264796	192.168.50.156	142.250.217.74	TCP	66	53104 → 443 [SYN, ECE, CWR] Seq=0 Win=8192 Len=0 MSS=1460 WS=256 SACK_PERM
171	75.266535	142.250.33.74	192.168.50.156	TCP	60	54144 → 443 [SYN] Seq=0 Win=64240 Len=0 MSS=1460 WS=256 SACK_PERM
172	76.871933	192.168.50.156	142.251.215.234	TCP	62	[TCP Retransmission] 53090 → 443 [SYN] Seq=0 Win=8192 Len=0 MSS=1460 SACK_PERM
173	77.12729	192.168.50.156	142.251.215.234	TCP	62	[TCP Retransmission] 53093 → 443 [SYN] Seq=0 Win=8192 Len=0 MSS=1460 SACK_PERM
174	77.756508	192.168.50.156	142.251.215.234	TCP	66	53107 → 443 [SYN, ECE, CWR] Seq=0 Win=8192 Len=0 MSS=1460 WS=256 SACK_PERM
175	77.759139	142.250.217.74	192.168.50.156	TCP	66	54136 → 80 [SYN] Seq=0 Win=64240 Len=0 MSS=1460 WS=256 SACK_PERM
176	78.265101	192.168.50.156	142.250.217.74	TCP	66	[TCP Retransmission] 53104 → 443 [SYN, ECE, CWR] Seq=0 Win=8192 Len=0 MSS=1460 WS=256 SACK_PERM
177	80.757139	192.168.50.156	142.251.215.234	TCP	66	[TCP Retransmission] 53107 → 443 [SYN, ECE, CWR] Seq=0 Win=8192 Len=0 MSS=1460 WS=256 SACK_PERM
178	83.98851	192.168.50.156	142.250.217.74	TCP	66	53116 → 443 [SYN, ECE, CWR] Seq=0 Win=8192 Len=0 MSS=1460 WS=256 SACK_PERM
179	83.991175	142.250.217.74	192.168.50.156	TCP	66	54132 → 80 [SYN] Seq=0 Win=64240 Len=0 MSS=1460 WS=256 SACK_PERM
180	84.217759	192.168.50.156	192.168.50.152	TCP	66	53118 → 80 [SYN, ECE, CWR] Seq=0 Win=8192 Len=0 MSS=1460 WS=256 SACK_PERM
181	84.218006	192.168.50.152	192.168.50.156	TCP	66	80 → 53118 [SYN, ACK] Seq=0 Ack=1 Win=29200 Len=0 MSS=1460 SACK_PERM WS=128
182	84.218102	192.168.50.156	192.168.50.152	TCP	54	53118 → 80 [ACK] Seq=1 Ack=1 Win=525568 Len=0
183	84.218362	192.168.50.156	192.168.50.152	HTTP	1307	GET /api/health/ HTTP/1.1 
184	84.218558	192.168.50.152	192.168.50.156	TCP	60	80 → 53118 [ACK] Seq=1 Ack=1254 Win=32128 Len=0
185	84.236391	192.168.50.152	192.168.50.156	HTTP/JSON	713	HTTP/1.1 200 OK , JSON (application/json)
186	84.240681	192.168.50.156	142.250.217.74	TCP	66	53119 → 443 [SYN, ECE, CWR] Seq=0 Win=8192 Len=0 MSS=1460 WS=256 SACK_PERM
187	84.242106	142.250.217.74	192.168.50.156	TCP	66	54132 → 80 [SYN] Seq=0 Win=64240 Len=0 MSS=1460 WS=256 SACK_PERM
188	84.265162	192.168.50.156	142.250.217.74	TCP	62	[TCP Retransmission] 53104 → 443 [SYN] Seq=0 Win=8192 Len=0 MSS=1460 SACK_PERM
189	84.287082	192.168.50.156	192.168.50.152	TCP	54	53118 → 80 [ACK] Seq=1254 Ack=660 Win=524800 Len=0
190	84.368762	142.250.33.106	192.168.50.156	TCP	60	54144 → 443 [SYN] Seq=0 Win=64240 Len=0 MSS=1460 WS=256 SACK_PERM
191	84.369057	192.168.50.156	142.251.211.234	TCP	66	53121 → 443 [SYN, ECE, CWR] Seq=0 Win=8192 Len=0 MSS=1460 WS=256 SACK_PERM
192	85.184644	192.168.50.156	180.163.252.201	TCP	55	[TCP Keep-Alive] 49742 → 80 [ACK] Seq=1 Ack=1 Win=63776 Len=1
193	85.18475	180.163.252.201	192.168.50.156	TCP	60	[TCP Keep-Alive ACK] 80 → 49742 [ACK] Seq=1 Ack=2 Win=64240 Len=0
194	86.26846	192.168.50.156	142.250.217.106	TCP	66	53124 → 443 [SYN, ECE, CWR] Seq=0 Win=8192 Len=0 MSS=1460 WS=256 SACK_PERM
195	86.269009	142.250.217.74	192.168.50.156	TCP	66	54132 → 80 [SYN] Seq=0 Win=64240 Len=0 MSS=1460 WS=256 SACK_PERM
196	86.757383	192.168.50.156	142.251.215.234	TCP	62	[TCP Retransmission] 53107 → 443 [SYN] Seq=0 Win=8192 Len=0 MSS=1460 SACK_PERM
197	86.989427	192.168.50.156	142.250.217.74	TCP	66	[TCP Retransmission] 53116 → 443 [SYN, ECE, CWR] Seq=0 Win=8192 Len=0 MSS=1460 WS=256 SACK_PERM
198	87.241561	192.168.50.156	142.250.217.74	TCP	66	[TCP Retransmission] 53119 → 443 [SYN, ECE, CWR] Seq=0 Win=8192 Len=0 MSS=1460 WS=256 SACK_PERM
199	87.369179	192.168.50.156	142.251.211.234	TCP	66	[TCP Retransmission] 53121 → 443 [SYN, ECE, CWR] Seq=0 Win=8192 Len=0 MSS=1460 WS=256 SACK_PERM
200	88.061731	192.168.50.156	192.168.50.152	TCP	54	53118 → 80 [FIN, ACK] Seq=1254 Ack=660 Win=524800 Len=0
201	88.062026	192.168.50.152	192.168.50.156	TCP	60	80 → 53118 [FIN, ACK] Seq=660 Ack=1255 Win=32128 Len=0
202	88.062053	192.168.50.156	192.168.50.152	TCP	54	53118 → 80 [ACK] Seq=1255 Ack=661 Win=524800 Len=0
203	88.871709	142.250.217.74	192.168.50.156	TCP	60	54145 → 443 [SYN] Seq=0 Win=64240 Len=0 MSS=1460 WS=256 SACK_PERM
204	88.871975	192.168.50.156	142.251.211.234	TCP	66	53128 → 443 [SYN, ECE, CWR] Seq=0 Win=8192 Len=0 MSS=1460 WS=256 SACK_PERM
205	89.128169	192.168.50.156	142.251.211.234	TCP	66	53129 → 443 [SYN, ECE, CWR] Seq=0 Win=8192 Len=0 MSS=1460 WS=256 SACK_PERM
206	89.131031	142.250.217.74	192.168.50.156	TCP	60	54146 → 443 [SYN] Seq=0 Win=64240 Len=0 MSS=1460 WS=256 SACK_PERM
207	89.269467	192.168.50.156	142.250.217.106	TCP	66	[TCP Retransmission] 53124 → 443 [SYN, ECE, CWR] Seq=0 Win=8192 Len=0 MSS=1460 WS=256 SACK_PERM
208	91.871548	192.168.50.156	142.251.211.234	TCP	66	[TCP Retransmission] 53128 → 443 [SYN, ECE, CWR] Seq=0 Win=8192 Len=0 MSS=1460 WS=256 SACK_PERM
209	92.128865	192.168.50.156	142.251.211.234	TCP	66	[TCP Retransmission] 53129 → 443 [SYN, ECE, CWR] Seq=0 Win=8192 Len=0 MSS=1460 WS=256 SACK_PERM
210	92.990395	192.168.50.156	142.250.217.74	TCP	62	[TCP Retransmission] 53116 → 443 [SYN] Seq=0 Win=8192 Len=0 MSS=1460 SACK_PERM
211	93.241888	192.168.50.156	142.250.217.74	TCP	62	[TCP Retransmission] 53119 → 443 [SYN] Seq=0 Win=8192 Len=0 MSS=1460 SACK_PERM
212	93.369381	192.168.50.156	142.251.211.234	TCP	62	[TCP Retransmission] 53121 → 443 [SYN] Seq=0 Win=8192 Len=0 MSS=1460 SACK_PERM
213	95.269642	192.168.50.156	142.250.217.106	TCP	62	[TCP Retransmission] 53124 → 443 [SYN] Seq=0 Win=8192 Len=0 MSS=1460 SACK_PERM
214	96.265647	192.168.50.156	142.250.217.106	TCP	66	53141 → 443 [SYN, ECE, CWR] Seq=0 Win=8192 Len=0 MSS=1460 WS=256 SACK_PERM
215	96.267322	142.250.217.74	192.168.50.156	TCP	66	54132 → 80 [SYN] Seq=0 Win=64240 Len=0 MSS=1460 WS=256 SACK_PERM
216	97.872596	192.168.50.156	142.251.211.234	TCP	62	[TCP Retransmission] 53128 → 443 [SYN] Seq=0 Win=8192 Len=0 MSS=1460 SACK_PERM
217	98.128963	192.168.50.156	142.251.211.234	TCP	62	[TCP Retransmission] 53129 → 443 [SYN] Seq=0 Win=8192 Len=0 MSS=1460 SACK_PERM
218	98.758649	142.250.217.74	192.168.50.156	TCP	60	54147 → 443 [SYN] Seq=0 Win=64240 Len=0 MSS=1460 WS=256 SACK_PERM
219	98.758903	192.168.50.156	142.251.211.234	TCP	66	53152 → 443 [SYN, ECE, CWR] Seq=0 Win=8192 Len=0 MSS=1460 WS=256 SACK_PERM
220	99.265481	192.168.50.156	142.250.217.106	TCP	66	[TCP Retransmission] 53141 → 443 [SYN, ECE, CWR] Seq=0 Win=8192 Len=0 MSS=1460 WS=256 SACK_PERM
221	101.759568	192.168.50.156	142.251.211.234	TCP	66	[TCP Retransmission] 53152 → 443 [SYN, ECE, CWR] Seq=0 Win=8192 Len=0 MSS=1460 WS=256 SACK_PERM
222	104.991357	192.168.50.156	172.217.14.234	TCP	66	53162 → 443 [SYN, ECE, CWR] Seq=0 Win=8192 Len=0 MSS=1460 WS=256 SACK_PERM
223	104.993926	142.250.217.74	192.168.50.156	TCP	66	54132 → 80 [SYN] Seq=0 Win=64240 Len=0 MSS=1460 WS=256 SACK_PERM
224	105.24262	192.168.50.156	172.217.14.234	TCP	66	53163 → 443 [SYN, ECE, CWR] Seq=0 Win=8192 Len=0 MSS=1460 WS=256 SACK_PERM
225	105.24459	142.250.217.74	192.168.50.156	TCP	66	54132 → 80 [SYN] Seq=0 Win=64240 Len=0 MSS=1460 WS=256 SACK_PERM
226	105.266239	192.168.50.156	142.250.217.106	TCP	62	[TCP Retransmission] 53141 → 443 [SYN] Seq=0 Win=8192 Len=0 MSS=1460 SACK_PERM
227	105.369842	142.250.217.74	192.168.50.156	TCP	60	54144 → 443 [SYN] Seq=0 Win=64240 Len=0 MSS=1460 WS=256 SACK_PERM
228	105.370267	192.168.50.156	142.250.69.202	TCP	66	53165 → 443 [SYN, ECE, CWR] Seq=0 Win=8192 Len=0 MSS=1460 WS=256 SACK_PERM
229	107.270359	192.168.50.156	142.251.215.234	TCP	66	53169 → 443 [SYN, ECE, CWR] Seq=0 Win=8192 Len=0 MSS=1460 WS=256 SACK_PERM
230	107.270933	142.250.217.74	192.168.50.156	TCP	66	54132 → 80 [SYN] Seq=0 Win=64240 Len=0 MSS=1460 WS=256 SACK_PERM
231	107.759996	192.168.50.156	142.251.211.234	TCP	62	[TCP Retransmission] 53152 → 443 [SYN] Seq=0 Win=8192 Len=0 MSS=1460 SACK_PERM
232	107.992087	192.168.50.156	172.217.14.234	TCP	66	[TCP Retransmission] 53162 → 443 [SYN, ECE, CWR] Seq=0 Win=8192 Len=0 MSS=1460 WS=256 SACK_PERM
233	108.243366	192.168.50.156	172.217.14.234	TCP	66	[TCP Retransmission] 53163 → 443 [SYN, ECE, CWR] Seq=0 Win=8192 Len=0 MSS=1460 WS=256 SACK_PERM
234	108.371071	192.168.50.156	142.250.69.202	TCP	66	[TCP Retransmission] 53165 → 443 [SYN, ECE, CWR] Seq=0 Win=8192 Len=0 MSS=1460 WS=256 SACK_PERM
235	109.875264	142.250.217.74	192.168.50.156	TCP	60	54144 → 443 [SYN] Seq=0 Win=64240 Len=0 MSS=1460 WS=256 SACK_PERM
236	110.130704	142.250.217.74	192.168.50.156	TCP	60	54144 → 443 [SYN] Seq=0 Win=64240 Len=0 MSS=1460 WS=256 SACK_PERM
237	110.270323	192.168.50.156	142.251.215.234	TCP	66	[TCP Retransmission] 53169 → 443 [SYN, ECE, CWR] Seq=0 Win=8192 Len=0 MSS=1460 WS=256 SACK_PERM
238	113.992013	192.168.50.156	172.217.14.234	TCP	62	[TCP Retransmission] 53162 → 443 [SYN] Seq=0 Win=8192 Len=0 MSS=1460 SACK_PERM
239	114.218921	192.168.50.156	192.168.50.152	TCP	66	53180 → 80 [SYN, ECE, CWR] Seq=0 Win=8192 Len=0 MSS=1460 WS=256 SACK_PERM
240	114.219191	192.168.50.152	192.168.50.156	TCP	66	80 → 53180 [SYN, ACK] Seq=0 Ack=1 Win=29200 Len=0 MSS=1460 SACK_PERM WS=128
241	114.21925	192.168.50.156	192.168.50.152	TCP	54	53180 → 80 [ACK] Seq=1 Ack=1 Win=525568 Len=0
242	114.21953	192.168.50.156	192.168.50.152	HTTP	1307	GET /api/health/ HTTP/1.1 
243	114.219678	192.168.50.152	192.168.50.156	TCP	60	80 → 53180 [ACK] Seq=1 Ack=1254 Win=32128 Len=0
244	114.235129	192.168.50.152	192.168.50.156	HTTP/JSON	711	HTTP/1.1 200 OK , JSON (application/json)
245	114.244491	192.168.50.156	172.217.14.234	TCP	62	[TCP Retransmission] 53163 → 443 [SYN] Seq=0 Win=8192 Len=0 MSS=1460 SACK_PERM
246	114.284374	192.168.50.156	192.168.50.152	TCP	54	53180 → 80 [ACK] Seq=1254 Ack=658 Win=524800 Len=0
247	114.372131	192.168.50.156	142.250.69.202	TCP	62	[TCP Retransmission] 53165 → 443 [SYN] Seq=0 Win=8192 Len=0 MSS=1460 SACK_PERM
248	116.270692	192.168.50.156	142.251.215.234	TCP	62	[TCP Retransmission] 53169 → 443 [SYN] Seq=0 Win=8192 Len=0 MSS=1460 SACK_PERM
249	117.266881	192.168.50.156	142.251.215.234	TCP	66	53184 → 443 [SYN, ECE, CWR] Seq=0 Win=8192 Len=0 MSS=1460 WS=256 SACK_PERM
250	117.269343	142.250.217.74	192.168.50.156	TCP	66	54132 → 80 [SYN] Seq=0 Win=64240 Len=0 MSS=1460 WS=256 SACK_PERM
251	118.068588	192.168.50.156	192.168.50.152	TCP	54	53180 → 80 [FIN, ACK] Seq=1254 Ack=658 Win=524800 Len=0
252	118.068855	192.168.50.152	192.168.50.156	TCP	60	80 → 53180 [FIN, ACK] Seq=658 Ack=1255 Win=32128 Len=0
253	118.068882	192.168.50.156	192.168.50.152	TCP	54	53180 → 80 [ACK] Seq=1255 Ack=659 Win=524800 Len=0
254	119.760716	142.250.217.74	192.168.50.156	TCP	60	54144 → 443 [SYN] Seq=0 Win=64240 Len=0 MSS=1460 WS=256 SACK_PERM
255	120.267467	192.168.50.156	142.251.215.234	TCP	66	[TCP Retransmission] 53184 → 443 [SYN, ECE, CWR] Seq=0 Win=8192 Len=0 MSS=1460 WS=256 SACK_PERM
256	122.391106	192.168.50.156	142.250.217.74	TCP	66	53195 → 443 [SYN, ECE, CWR] Seq=0 Win=8192 Len=0 MSS=1460 WS=256 SACK_PERM
257	125.390826	192.168.50.156	142.250.217.74	TCP	66	[TCP Retransmission] 53195 → 443 [SYN, ECE, CWR] Seq=0 Win=8192 Len=0 MSS=1460 WS=256 SACK_PERM
258	125.992545	172.217.14.234	192.168.50.156	TCP	60	443 → 53162 [RST, ACK] Seq=1 Ack=1 Win=64240 Len=0
259	125.99289	192.168.50.156	142.250.69.202	TCP	66	53204 → 443 [SYN, ECE, CWR] Seq=0 Win=8192 Len=0 MSS=1460 WS=256 SACK_PERM
260	126.245151	192.168.50.156	142.250.69.202	TCP	66	53205 → 443 [SYN, ECE, CWR] Seq=0 Win=8192 Len=0 MSS=1460 WS=256 SACK_PERM
261	126.24588	172.217.14.234	192.168.50.156	TCP	60	443 → 53163 [RST, ACK] Seq=1 Ack=1 Win=64240 Len=0
262	126.269775	192.168.50.156	142.251.215.234	TCP	62	[TCP Retransmission] 53184 → 443 [SYN] Seq=0 Win=8192 Len=0 MSS=1460 SACK_PERM
263	126.371637	192.168.50.156	142.250.217.74	TCP	66	53206 → 443 [SYN, ECE, CWR] Seq=0 Win=8192 Len=0 MSS=1460 WS=256 SACK_PERM
264	126.373515	142.250.69.202	192.168.50.156	TCP	60	54144 → 443 [SYN] Seq=0 Win=64240 Len=0 MSS=1460 WS=256 SACK_PERM
265	128.270982	192.168.50.156	142.251.211.234	TCP	66	53210 → 443 [SYN, ECE, CWR] Seq=0 Win=8192 Len=0 MSS=1460 WS=256 SACK_PERM
266	128.27375	142.250.217.74	192.168.50.156	TCP	60	54144 → 443 [SYN] Seq=0 Win=64240 Len=0 MSS=1460 WS=256 SACK_PERM
267	128.993455	192.168.50.156	142.250.69.202	TCP	66	[TCP Retransmission] 53204 → 443 [SYN, ECE, CWR] Seq=0 Win=8192 Len=0 MSS=1460 WS=256 SACK_PERM
268	129.2445	192.168.50.156	142.250.69.202	TCP	66	[TCP Retransmission] 53205 → 443 [SYN, ECE, CWR] Seq=0 Win=8192 Len=0 MSS=1460 WS=256 SACK_PERM
269	129.372159	192.168.50.156	142.250.217.74	TCP	66	[TCP Retransmission] 53206 → 443 [SYN, ECE, CWR] Seq=0 Win=8192 Len=0 MSS=1460 WS=256 SACK_PERM
270	130.184522	192.168.50.156	180.163.252.201	TCP	55	[TCP Keep-Alive] 49742 → 80 [ACK] Seq=1 Ack=1 Win=63776 Len=1
271	130.184607	180.163.252.201	192.168.50.156	TCP	60	[TCP Keep-Alive ACK] 80 → 49742 [ACK] Seq=1 Ack=2 Win=64240 Len=0
272	130.355783	142.250.217.74	192.168.50.156	TCP	66	54132 → 80 [SYN] Seq=0 Win=64240 Len=0 MSS=1460 WS=256 SACK_PERM
273	130.356156	192.168.50.156	112.65.210.102	TCP	70	50200 → 80 [PSH, ACK] Seq=113 Ack=9841 Win=64240 Len=16
274	130.356299	142.250.217.74	192.168.50.156	TCP	66	54132 → 80 [SYN] Seq=0 Win=64240 Len=0 MSS=1460 WS=256 SACK_PERM
275	131.271332	192.168.50.156	142.251.211.234	TCP	66	[TCP Retransmission] 53210 → 443 [SYN, ECE, CWR] Seq=0 Win=8192 Len=0 MSS=1460 WS=256 SACK_PERM
276	131.390905	192.168.50.156	142.250.217.74	TCP	62	[TCP Retransmission] 53195 → 443 [SYN] Seq=0 Win=8192 Len=0 MSS=1460 SACK_PERM
277	132.267912	192.168.50.156	142.250.217.74	TCP	66	53216 → 443 [SYN, ECE, CWR] Seq=0 Win=8192 Len=0 MSS=1460 WS=256 SACK_PERM
278	134.993883	192.168.50.156	142.250.69.202	TCP	62	[TCP Retransmission] 53204 → 443 [SYN] Seq=0 Win=8192 Len=0 MSS=1460 SACK_PERM
279	135.245842	192.168.50.156	142.250.69.202	TCP	62	[TCP Retransmission] 53205 → 443 [SYN] Seq=0 Win=8192 Len=0 MSS=1460 SACK_PERM
280	135.267799	192.168.50.156	142.250.217.74	TCP	66	[TCP Retransmission] 53216 → 443 [SYN, ECE, CWR] Seq=0 Win=8192 Len=0 MSS=1460 WS=256 SACK_PERM
281	135.37168	192.168.50.156	142.250.217.74	TCP	62	[TCP Retransmission] 53206 → 443 [SYN] Seq=0 Win=8192 Len=0 MSS=1460 SACK_PERM
282	137.272397	192.168.50.156	142.251.211.234	TCP	62	[TCP Retransmission] 53210 → 443 [SYN] Seq=0 Win=8192 Len=0 MSS=1460 SACK_PERM
283	138.270349	142.250.217.74	192.168.50.156	TCP	60	54144 → 443 [SYN] Seq=0 Win=64240 Len=0 MSS=1460 WS=256 SACK_PERM
284	138.270832	192.168.50.156	142.251.211.234	TCP	66	53225 → 443 [SYN, ECE, CWR] Seq=0 Win=8192 Len=0 MSS=1460 WS=256 SACK_PERM
285	141.267984	192.168.50.156	142.250.217.74	TCP	62	[TCP Retransmission] 53216 → 443 [SYN] Seq=0 Win=8192 Len=0 MSS=1460 SACK_PERM
286	141.271121	192.168.50.156	142.251.211.234	TCP	66	[TCP Retransmission] 53225 → 443 [SYN, ECE, CWR] Seq=0 Win=8192 Len=0 MSS=1460 WS=256 SACK_PERM
287	143.391667	192.168.50.156	142.251.33.106	TCP	66	53233 → 443 [SYN, ECE, CWR] Seq=0 Win=8192 Len=0 MSS=1460 WS=256 SACK_PERM
288	143.395419	142.250.217.74	192.168.50.156	TCP	66	54132 → 80 [SYN] Seq=0 Win=64240 Len=0 MSS=1460 WS=256 SACK_PERM
289	144.218488	192.168.50.156	192.168.50.152	TCP	66	53235 → 80 [SYN, ECE, CWR] Seq=0 Win=8192 Len=0 MSS=1460 WS=256 SACK_PERM
290	144.218727	192.168.50.152	192.168.50.156	TCP	66	80 → 53235 [SYN, ACK] Seq=0 Ack=1 Win=29200 Len=0 MSS=1460 SACK_PERM WS=128
291	144.218792	192.168.50.156	192.168.50.152	TCP	54	53235 → 80 [ACK] Seq=1 Ack=1 Win=525568 Len=0
292	144.219034	192.168.50.156	192.168.50.152	HTTP	1307	GET /api/health/ HTTP/1.1 
293	144.219178	192.168.50.152	192.168.50.156	TCP	60	80 → 53235 [ACK] Seq=1 Ack=1254 Win=32128 Len=0
294	144.234101	192.168.50.152	192.168.50.156	HTTP/JSON	714	HTTP/1.1 200 OK , JSON (application/json)
295	144.283652	192.168.50.156	192.168.50.152	TCP	54	53235 → 80 [ACK] Seq=1254 Ack=661 Win=524800 Len=0
296	146.391819	192.168.50.156	142.251.33.106	TCP	66	[TCP Retransmission] 53233 → 443 [SYN, ECE, CWR] Seq=0 Win=8192 Len=0 MSS=1460 WS=256 SACK_PERM
297	146.995321	192.168.50.156	142.251.211.234	TCP	66	53240 → 443 [SYN, ECE, CWR] Seq=0 Win=8192 Len=0 MSS=1460 WS=256 SACK_PERM
298	146.996066	142.250.69.202	192.168.50.156	TCP	60	54144 → 443 [SYN] Seq=0 Win=64240 Len=0 MSS=1460 WS=256 SACK_PERM
299	147.246277	192.168.50.156	142.251.211.234	TCP	66	53243 → 443 [SYN, ECE, CWR] Seq=0 Win=8192 Len=0 MSS=1460 WS=256 SACK_PERM
300	147.248445	142.250.69.202	192.168.50.156	TCP	60	54144 → 443 [SYN] Seq=0 Win=64240 Len=0 MSS=1460 WS=256 SACK_PERM
301	147.271313	192.168.50.156	142.251.211.234	TCP	62	[TCP Retransmission] 53225 → 443 [SYN] Seq=0 Win=8192 Len=0 MSS=1460 SACK_PERM
302	147.372448	192.168.50.156	172.217.14.234	TCP	66	53244 → 443 [SYN, ECE, CWR] Seq=0 Win=8192 Len=0 MSS=1460 WS=256 SACK_PERM
303	147.37606	142.250.217.74	192.168.50.156	TCP	66	54132 → 80 [SYN] Seq=0 Win=64240 Len=0 MSS=1460 WS=256 SACK_PERM
304	148.073007	192.168.50.156	192.168.50.152	TCP	54	53235 → 80 [FIN, ACK] Seq=1254 Ack=661 Win=524800 Len=0
305	148.073366	192.168.50.152	192.168.50.156	TCP	60	80 → 53235 [FIN, ACK] Seq=661 Ack=1255 Win=32128 Len=0
306	148.073395	192.168.50.156	192.168.50.152	TCP	54	53235 → 80 [ACK] Seq=1255 Ack=662 Win=524800 Len=0
307	149.272963	142.250.217.74	192.168.50.156	TCP	60	54144 → 443 [SYN] Seq=0 Win=64240 Len=0 MSS=1460 WS=256 SACK_PERM
308	149.995989	192.168.50.156	142.251.211.234	TCP	66	[TCP Retransmission] 53240 → 443 [SYN, ECE, CWR] Seq=0 Win=8192 Len=0 MSS=1460 WS=256 SACK_PERM
309	150.247242	192.168.50.156	142.251.211.234	TCP	66	[TCP Retransmission] 53243 → 443 [SYN, ECE, CWR] Seq=0 Win=8192 Len=0 MSS=1460 WS=256 SACK_PERM
310	150.372436	192.168.50.156	172.217.14.234	TCP	66	[TCP Retransmission] 53244 → 443 [SYN, ECE, CWR] Seq=0 Win=8192 Len=0 MSS=1460 WS=256 SACK_PERM
311	152.392872	192.168.50.156	142.251.33.106	TCP	62	[TCP Retransmission] 53233 → 443 [SYN] Seq=0 Win=8192 Len=0 MSS=1460 SACK_PERM
312	153.268374	192.168.50.156	142.251.33.106	TCP	66	53252 → 443 [SYN, ECE, CWR] Seq=0 Win=8192 Len=0 MSS=1460 WS=256 SACK_PERM
313	153.270015	142.250.217.74	192.168.50.156	TCP	66	54132 → 80 [SYN] Seq=0 Win=64240 Len=0 MSS=1460 WS=256 SACK_PERM
314	155.995722	192.168.50.156	142.251.211.234	TCP	62	[TCP Retransmission] 53240 → 443 [SYN] Seq=0 Win=8192 Len=0 MSS=1460 SACK_PERM
315	156.248116	192.168.50.156	142.251.211.234	TCP	62	[TCP Retransmission] 53243 → 443 [SYN] Seq=0 Win=8192 Len=0 MSS=1460 SACK_PERM
316	156.269054	192.168.50.156	142.251.33.106	TCP	66	[TCP Retransmission] 53252 → 443 [SYN, ECE, CWR] Seq=0 Win=8192 Len=0 MSS=1460 WS=256 SACK_PERM
317	156.373775	192.168.50.156	172.217.14.234	TCP	62	[TCP Retransmission] 53244 → 443 [SYN] Seq=0 Win=8192 Len=0 MSS=1460 SACK_PERM
318	159.272051	142.250.217.74	192.168.50.156	TCP	60	54144 → 443 [SYN] Seq=0 Win=64240 Len=0 MSS=1460 WS=256 SACK_PERM
319	160.181683	192.168.50.156	180.163.252.201	TCP	70	49742 → 80 [PSH, ACK] Seq=2 Ack=1 Win=63776 Len=16
320	160.181902	180.163.252.201	192.168.50.156	TCP	60	80 → 49742 [ACK] Seq=1 Ack=18 Win=64240 Len=0
321	160.189218	180.163.252.201	192.168.50.156	TCP	70	80 → 49742 [PSH, ACK] Seq=1 Ack=18 Win=64240 Len=16
322	160.240427	192.168.50.156	180.163.252.201	TCP	54	49742 → 80 [ACK] Seq=18 Ack=17 Win=63760 Len=0
323	160.494983	192.168.50.156	8.8.4.4	TCP	66	53274 → 443 [SYN, ECE, CWR] Seq=0 Win=8192 Len=0 MSS=1460 WS=256 SACK_PERM
324	160.745887	192.168.50.156	8.8.4.4	TCP	66	53275 → 443 [SYN, ECE, CWR] Seq=0 Win=8192 Len=0 MSS=1460 WS=256 SACK_PERM
325	162.268508	192.168.50.156	142.251.33.106	TCP	62	[TCP Retransmission] 53252 → 443 [SYN] Seq=0 Win=8192 Len=0 MSS=1460 SACK_PERM
326	163.495207	192.168.50.156	8.8.4.4	TCP	66	[TCP Retransmission] 53274 → 443 [SYN, ECE, CWR] Seq=0 Win=8192 Len=0 MSS=1460 WS=256 SACK_PERM
327	163.746084	192.168.50.156	8.8.4.4	TCP	66	[TCP Retransmission] 53275 → 443 [SYN, ECE, CWR] Seq=0 Win=8192 Len=0 MSS=1460 WS=256 SACK_PERM
328	164.392706	192.168.50.156	142.251.215.234	TCP	66	53280 → 443 [SYN, ECE, CWR] Seq=0 Win=8192 Len=0 MSS=1460 WS=256 SACK_PERM
329	164.393601	142.250.33.106	192.168.50.156	TCP	60	54144 → 443 [SYN] Seq=0 Win=64240 Len=0 MSS=1460 WS=256 SACK_PERM
330	167.393219	192.168.50.156	142.251.215.234	TCP	66	[TCP Retransmission] 53280 → 443 [SYN, ECE, CWR] Seq=0 Win=8192 Len=0 MSS=1460 WS=256 SACK_PERM
331	167.95957	142.250.217.74	192.168.50.156	TCP	66	54132 → 80 [SYN] Seq=0 Win=64240 Len=0 MSS=1460 WS=256 SACK_PERM
332	167.960133	192.168.50.156	112.65.210.102	TCP	70	50200 → 80 [PSH, ACK] Seq=129 Ack=11117 Win=62964 Len=16
333	167.960412	142.250.217.74	192.168.50.156	TCP	66	54132 → 80 [SYN] Seq=0 Win=64240 Len=0 MSS=1460 WS=256 SACK_PERM
334	167.996406	192.168.50.156	142.251.33.106	TCP	66	53287 → 443 [SYN, ECE, CWR] Seq=0 Win=8192 Len=0 MSS=1460 WS=256 SACK_PERM
335	167.999177	142.250.217.74	192.168.50.156	TCP	60	54144 → 443 [SYN] Seq=0 Win=64240 Len=0 MSS=1460 WS=256 SACK_PERM
336	168.248371	192.168.50.156	142.251.33.106	TCP	66	53288 → 443 [SYN, ECE, CWR] Seq=0 Win=8192 Len=0 MSS=1460 WS=256 SACK_PERM
337	168.250106	142.250.217.74	192.168.50.156	TCP	60	54144 → 443 [SYN] Seq=0 Win=64240 Len=0 MSS=1460 WS=256 SACK_PERM
338	168.375058	192.168.50.156	142.251.33.74	TCP	66	53289 → 443 [SYN, ECE, CWR] Seq=0 Win=8192 Len=0 MSS=1460 WS=256 SACK_PERM
339	168.376811	172.217.14.234	192.168.50.156	TCP	60	443 → 53244 [RST, ACK] Seq=1 Ack=1 Win=64240 Len=0
340	169.496735	192.168.50.156	8.8.4.4	TCP	62	[TCP Retransmission] 53274 → 443 [SYN] Seq=0 Win=8192 Len=0 MSS=1460 SACK_PERM
341	169.745423	192.168.50.156	8.8.4.4	TCP	62	[TCP Retransmission] 53275 → 443 [SYN] Seq=0 Win=8192 Len=0 MSS=1460 SACK_PERM
342	170.997496	192.168.50.156	142.251.33.106	TCP	66	[TCP Retransmission] 53287 → 443 [SYN, ECE, CWR] Seq=0 Win=8192 Len=0 MSS=1460 WS=256 SACK_PERM
343	171.248582	192.168.50.156	142.251.33.106	TCP	66	[TCP Retransmission] 53288 → 443 [SYN, ECE, CWR] Seq=0 Win=8192 Len=0 MSS=1460 WS=256 SACK_PERM
344	171.374808	192.168.50.156	142.251.33.74	TCP	66	[TCP Retransmission] 53289 → 443 [SYN, ECE, CWR] Seq=0 Win=8192 Len=0 MSS=1460 WS=256 SACK_PERM
345	173.394713	192.168.50.156	142.251.215.234	TCP	62	[TCP Retransmission] 53280 → 443 [SYN] Seq=0 Win=8192 Len=0 MSS=1460 SACK_PERM
346	173.589117	142.250.217.74	192.168.50.156	TCP	66	54132 → 80 [SYN] Seq=0 Win=64240 Len=0 MSS=1460 WS=256 SACK_PERM
347	173.589571	192.168.50.156	112.65.210.102	TCP	70	50200 → 80 [PSH, ACK] Seq=145 Ack=12393 Win=64240 Len=16
348	173.589772	142.250.217.74	192.168.50.156	TCP	66	54132 → 80 [SYN] Seq=0 Win=64240 Len=0 MSS=1460 WS=256 SACK_PERM
349	174.218464	192.168.50.156	192.168.50.152	TCP	66	53299 → 80 [SYN, ECE, CWR] Seq=0 Win=8192 Len=0 MSS=1460 WS=256 SACK_PERM
350	174.218727	192.168.50.152	192.168.50.156	TCP	66	80 → 53299 [SYN, ACK] Seq=0 Ack=1 Win=29200 Len=0 MSS=1460 SACK_PERM WS=128
351	174.218802	192.168.50.156	192.168.50.152	TCP	54	53299 → 80 [ACK] Seq=1 Ack=1 Win=525568 Len=0
352	174.219291	192.168.50.156	192.168.50.152	HTTP	1307	GET /api/health/ HTTP/1.1 
353	174.219475	192.168.50.152	192.168.50.156	TCP	60	80 → 53299 [ACK] Seq=1 Ack=1254 Win=32128 Len=0
354	174.234871	192.168.50.152	192.168.50.156	HTTP/JSON	713	HTTP/1.1 200 OK , JSON (application/json)
355	174.269972	192.168.50.156	142.251.215.234	TCP	66	53300 → 443 [SYN, ECE, CWR] Seq=0 Win=8192 Len=0 MSS=1460 WS=256 SACK_PERM
356	174.272594	142.250.33.106	192.168.50.156	TCP	60	54144 → 443 [SYN] Seq=0 Win=64240 Len=0 MSS=1460 WS=256 SACK_PERM
357	174.285604	192.168.50.156	192.168.50.152	TCP	54	53299 → 80 [ACK] Seq=1254 Ack=660 Win=524800 Len=0
358	176.997413	192.168.50.156	142.251.33.106	TCP	62	[TCP Retransmission] 53287 → 443 [SYN] Seq=0 Win=8192 Len=0 MSS=1460 SACK_PERM
359	177.2493	192.168.50.156	142.251.33.106	TCP	62	[TCP Retransmission] 53288 → 443 [SYN] Seq=0 Win=8192 Len=0 MSS=1460 SACK_PERM
360	177.269522	192.168.50.156	142.251.215.234	TCP	66	[TCP Retransmission] 53300 → 443 [SYN, ECE, CWR] Seq=0 Win=8192 Len=0 MSS=1460 WS=256 SACK_PERM
361	177.374954	192.168.50.156	142.251.33.74	TCP	62	[TCP Retransmission] 53289 → 443 [SYN] Seq=0 Win=8192 Len=0 MSS=1460 SACK_PERM
362	178.079292	192.168.50.156	192.168.50.152	TCP	54	53299 → 80 [FIN, ACK] Seq=1254 Ack=660 Win=524800 Len=0
363	178.08035	192.168.50.152	192.168.50.156	TCP	60	80 → 53299 [FIN, ACK] Seq=660 Ack=1255 Win=32128 Len=0
364	178.080407	192.168.50.156	192.168.50.152	TCP	54	53299 → 80 [ACK] Seq=1255 Ack=661 Win=524800 Len=0
365	181.496939	192.168.50.156	8.8.8.8	TCP	66	53311 → 443 [SYN, ECE, CWR] Seq=0 Win=8192 Len=0 MSS=1460 WS=256 SACK_PERM
366	181.499662	8.8.4.4	192.168.50.156	TCP	60	443 → 53274 [RST, ACK] Seq=1 Ack=1 Win=64240 Len=0
367	181.746466	192.168.50.156	8.8.8.8	TCP	66	53313 → 443 [SYN, ECE, CWR] Seq=0 Win=8192 Len=0 MSS=1460 WS=256 SACK_PERM
368	181.748984	8.8.4.4	192.168.50.156	TCP	60	443 → 53275 [RST, ACK] Seq=1 Ack=1 Win=64240 Len=0
369	183.270859	192.168.50.156	142.251.215.234	TCP	62	[TCP Retransmission] 53300 → 443 [SYN] Seq=0 Win=8192 Len=0 MSS=1460 SACK_PERM
370	184.497751	192.168.50.156	8.8.8.8	TCP	66	[TCP Retransmission] 53311 → 443 [SYN, ECE, CWR] Seq=0 Win=8192 Len=0 MSS=1460 WS=256 SACK_PERM
371	184.747323	192.168.50.156	8.8.8.8	TCP	66	[TCP Retransmission] 53313 → 443 [SYN, ECE, CWR] Seq=0 Win=8192 Len=0 MSS=1460 WS=256 SACK_PERM
372	185.395898	192.168.50.156	142.251.211.234	TCP	66	53319 → 443 [SYN, ECE, CWR] Seq=0 Win=8192 Len=0 MSS=1460 WS=256 SACK_PERM
373	185.396576	142.250.217.74	192.168.50.156	TCP	60	54144 → 443 [SYN] Seq=0 Win=64240 Len=0 MSS=1460 WS=256 SACK_PERM
374	188.396746	192.168.50.156	142.251.211.234	TCP	66	[TCP Retransmission] 53319 → 443 [SYN, ECE, CWR] Seq=0 Win=8192 Len=0 MSS=1460 WS=256 SACK_PERM
375	188.999033	192.168.50.156	142.251.215.234	TCP	66	53327 → 443 [SYN, ECE, CWR] Seq=0 Win=8192 Len=0 MSS=1460 WS=256 SACK_PERM
376	189.000777	142.250.33.106	192.168.50.156	TCP	60	54144 → 443 [SYN] Seq=0 Win=64240 Len=0 MSS=1460 WS=256 SACK_PERM
377	189.250183	192.168.50.156	142.251.215.234	TCP	66	53329 → 443 [SYN, ECE, CWR] Seq=0 Win=8192 Len=0 MSS=1460 WS=256 SACK_PERM
378	189.256379	142.250.33.106	192.168.50.156	TCP	60	54144 → 443 [SYN] Seq=0 Win=64240 Len=0 MSS=1460 WS=256 SACK_PERM
379	189.375018	192.168.50.156	142.250.217.106	TCP	66	53330 → 443 [SYN, ECE, CWR] Seq=0 Win=8192 Len=0 MSS=1460 WS=256 SACK_PERM
380	189.382763	142.250.33.74	192.168.50.156	TCP	60	54144 → 443 [SYN] Seq=0 Win=64240 Len=0 MSS=1460 WS=256 SACK_PERM
381	190.497391	192.168.50.156	8.8.8.8	TCP	62	[TCP Retransmission] 53311 → 443 [SYN] Seq=0 Win=8192 Len=0 MSS=1460 SACK_PERM
382	190.747767	192.168.50.156	8.8.8.8	TCP	62	[TCP Retransmission] 53313 → 443 [SYN] Seq=0 Win=8192 Len=0 MSS=1460 SACK_PERM
383	191.999859	192.168.50.156	142.251.215.234	TCP	66	[TCP Retransmission] 53327 → 443 [SYN, ECE, CWR] Seq=0 Win=8192 Len=0 MSS=1460 WS=256 SACK_PERM
384	192.250714	192.168.50.156	142.251.215.234	TCP	66	[TCP Retransmission] 53329 → 443 [SYN, ECE, CWR] Seq=0 Win=8192 Len=0 MSS=1460 WS=256 SACK_PERM
385	192.374707	192.168.50.156	142.250.217.106	TCP	66	[TCP Retransmission] 53330 → 443 [SYN, ECE, CWR] Seq=0 Win=8192 Len=0 MSS=1460 WS=256 SACK_PERM
386	194.397548	192.168.50.156	142.251.211.234	TCP	62	[TCP Retransmission] 53319 → 443 [SYN] Seq=0 Win=8192 Len=0 MSS=1460 SACK_PERM
387	195.271047	192.168.50.156	142.251.211.234	TCP	66	53339 → 443 [SYN, ECE, CWR] Seq=0 Win=8192 Len=0 MSS=1460 WS=256 SACK_PERM
388	195.275744	142.250.217.74	192.168.50.156	TCP	60	54144 → 443 [SYN] Seq=0 Win=64240 Len=0 MSS=1460 WS=256 SACK_PERM
389	198.000275	192.168.50.156	142.251.215.234	TCP	62	[TCP Retransmission] 53327 → 443 [SYN] Seq=0 Win=8192 Len=0 MSS=1460 SACK_PERM
390	198.250753	192.168.50.156	142.251.215.234	TCP	62	[TCP Retransmission] 53329 → 443 [SYN] Seq=0 Win=8192 Len=0 MSS=1460 SACK_PERM
391	198.271703	192.168.50.156	142.251.211.234	TCP	66	[TCP Retransmission] 53339 → 443 [SYN, ECE, CWR] Seq=0 Win=8192 Len=0 MSS=1460 WS=256 SACK_PERM
392	198.37527	192.168.50.156	142.250.217.106	TCP	62	[TCP Retransmission] 53330 → 443 [SYN] Seq=0 Win=8192 Len=0 MSS=1460 SACK_PERM
393	202.500306	8.8.8.8	192.168.50.156	TCP	60	443 → 53311 [RST, ACK] Seq=1 Ack=1 Win=64240 Len=0
394	202.749313	8.8.8.8	192.168.50.156	TCP	60	443 → 53313 [RST, ACK] Seq=1 Ack=1 Win=64240 Len=0
395	204.218933	192.168.50.156	192.168.50.152	TCP	66	53352 → 80 [SYN, ECE, CWR] Seq=0 Win=8192 Len=0 MSS=1460 WS=256 SACK_PERM
396	204.219191	192.168.50.152	192.168.50.156	TCP	66	80 → 53352 [SYN, ACK] Seq=0 Ack=1 Win=29200 Len=0 MSS=1460 SACK_PERM WS=128
397	204.219263	192.168.50.156	192.168.50.152	TCP	54	53352 → 80 [ACK] Seq=1 Ack=1 Win=525568 Len=0
398	204.219527	192.168.50.156	192.168.50.152	HTTP	1307	GET /api/health/ HTTP/1.1 
399	204.21966	192.168.50.152	192.168.50.156	TCP	60	80 → 53352 [ACK] Seq=1 Ack=1254 Win=32128 Len=0
400	204.233094	192.168.50.152	192.168.50.156	HTTP/JSON	713	HTTP/1.1 200 OK , JSON (application/json)
401	204.272174	192.168.50.156	142.251.211.234	TCP	62	[TCP Retransmission] 53339 → 443 [SYN] Seq=0 Win=8192 Len=0 MSS=1460 SACK_PERM
402	204.28321	192.168.50.156	192.168.50.152	TCP	54	53352 → 80 [ACK] Seq=1254 Ack=660 Win=524800 Len=0
403	205.190495	192.168.50.156	180.163.252.201	TCP	55	[TCP Keep-Alive] 49742 → 80 [ACK] Seq=17 Ack=17 Win=63760 Len=1
404	206.397972	142.250.217.74	192.168.50.156	TCP	60	54144 → 443 [SYN] Seq=0 Win=64240 Len=0 MSS=1460 WS=256 SACK_PERM
405	206.398246	192.168.50.156	172.217.14.202	TCP	66	53356 → 443 [SYN, ECE, CWR] Seq=0 Win=8192 Len=0 MSS=1460 WS=256 SACK_PERM
406	208.084832	192.168.50.156	192.168.50.152	TCP	54	53352 → 80 [FIN, ACK] Seq=1254 Ack=660 Win=524800 Len=0
407	208.085126	192.168.50.152	192.168.50.156	TCP	60	80 → 53352 [FIN, ACK] Seq=660 Ack=1255 Win=32128 Len=0
408	208.085151	192.168.50.156	192.168.50.152	TCP	54	53352 → 80 [ACK] Seq=1255 Ack=661 Win=524800 Len=0
409	209.397963	192.168.50.156	172.217.14.202	TCP	66	[TCP Retransmission] 53356 → 443 [SYN, ECE, CWR] Seq=0 Win=8192 Len=0 MSS=1460 WS=256 SACK_PERM
410	210.001622	192.168.50.156	142.251.33.74	TCP	66	53363 → 443 [SYN, ECE, CWR] Seq=0 Win=8192 Len=0 MSS=1460 WS=256 SACK_PERM
411	210.002276	142.250.217.74	192.168.50.156	TCP	60	54144 → 443 [SYN] Seq=0 Win=64240 Len=0 MSS=1460 WS=256 SACK_PERM
412	210.250741	142.250.217.74	192.168.50.156	TCP	60	54144 → 443 [SYN] Seq=0 Win=64240 Len=0 MSS=1460 WS=256 SACK_PERM
413	210.250985	192.168.50.156	142.251.33.74	TCP	66	53364 → 443 [SYN, ECE, CWR] Seq=0 Win=8192 Len=0 MSS=1460 WS=256 SACK_PERM
414	210.378371	142.250.217.74	192.168.50.156	TCP	66	54132 → 80 [SYN] Seq=0 Win=64240 Len=0 MSS=1460 WS=256 SACK_PERM
415	213.002642	192.168.50.156	142.251.33.74	TCP	66	[TCP Retransmission] 53363 → 443 [SYN, ECE, CWR] Seq=0 Win=8192 Len=0 MSS=1460 WS=256 SACK_PERM
416	213.251384	192.168.50.156	142.251.33.74	TCP	66	[TCP Retransmission] 53364 → 443 [SYN, ECE, CWR] Seq=0 Win=8192 Len=0 MSS=1460 WS=256 SACK_PERM
417	215.39846	192.168.50.156	172.217.14.202	TCP	62	[TCP Retransmission] 53356 → 443 [SYN] Seq=0 Win=8192 Len=0 MSS=1460 SACK_PERM
418	216.272161	142.250.217.74	192.168.50.156	TCP	60	54144 → 443 [SYN] Seq=0 Win=64240 Len=0 MSS=1460 WS=256 SACK_PERM
419	216.272444	192.168.50.156	172.217.14.202	TCP	66	53374 → 443 [SYN, ECE, CWR] Seq=0 Win=8192 Len=0 MSS=1460 WS=256 SACK_PERM
420	219.003999	192.168.50.156	142.251.33.74	TCP	62	[TCP Retransmission] 53363 → 443 [SYN] Seq=0 Win=8192 Len=0 MSS=1460 SACK_PERM
421	219.25148	192.168.50.156	142.251.33.74	TCP	62	[TCP Retransmission] 53364 → 443 [SYN] Seq=0 Win=8192 Len=0 MSS=1460 SACK_PERM
422	219.272377	192.168.50.156	172.217.14.202	TCP	66	[TCP Retransmission] 53374 → 443 [SYN, ECE, CWR] Seq=0 Win=8192 Len=0 MSS=1460 WS=256 SACK_PERM
423	225.272421	192.168.50.156	172.217.14.202	TCP	62	[TCP Retransmission] 53374 → 443 [SYN] Seq=0 Win=8192 Len=0 MSS=1460 SACK_PERM
424	227.400381	172.217.14.202	192.168.50.156	TCP	60	443 → 53356 [RST, ACK] Seq=1 Ack=1 Win=64240 Len=0
425	227.400467	192.168.50.156	142.250.69.202	TCP	66	53398 → 443 [SYN, ECE, CWR] Seq=0 Win=8192 Len=0 MSS=1460 WS=256 SACK_PERM
426	230.400328	192.168.50.156	142.250.69.202	TCP	66	[TCP Retransmission] 53398 → 443 [SYN, ECE, CWR] Seq=0 Win=8192 Len=0 MSS=1460 WS=256 SACK_PERM
427	231.004811	192.168.50.156	172.217.14.202	TCP	66	53403 → 443 [SYN, ECE, CWR] Seq=0 Win=8192 Len=0 MSS=1460 WS=256 SACK_PERM
428	231.005238	142.250.33.74	192.168.50.156	TCP	60	54144 → 443 [SYN] Seq=0 Win=64240 Len=0 MSS=1460 WS=256 SACK_PERM
429	231.252531	192.168.50.156	172.217.14.202	TCP	66	53404 → 443 [SYN, ECE, CWR] Seq=0 Win=8192 Len=0 MSS=1460 WS=256 SACK_PERM
430	231.254328	142.250.33.74	192.168.50.156	TCP	60	54144 → 443 [SYN] Seq=0 Win=64240 Len=0 MSS=1460 WS=256 SACK_PERM
431	234.005499	192.168.50.156	172.217.14.202	TCP	66	[TCP Retransmission] 53403 → 443 [SYN, ECE, CWR] Seq=0 Win=8192 Len=0 MSS=1460 WS=256 SACK_PERM
432	234.218274	192.168.50.156	192.168.50.152	TCP	66	53409 → 80 [SYN, ECE, CWR] Seq=0 Win=8192 Len=0 MSS=1460 WS=256 SACK_PERM
433	234.218569	192.168.50.152	192.168.50.156	TCP	66	80 → 53409 [SYN, ACK] Seq=0 Ack=1 Win=29200 Len=0 MSS=1460 SACK_PERM WS=128
434	234.218629	192.168.50.156	192.168.50.152	TCP	54	53409 → 80 [ACK] Seq=1 Ack=1 Win=525568 Len=0
435	234.218874	192.168.50.156	192.168.50.152	HTTP	1307	GET /api/health/ HTTP/1.1 
436	234.219037	192.168.50.152	192.168.50.156	TCP	60	80 → 53409 [ACK] Seq=1 Ack=1254 Win=32128 Len=0
437	234.232731	192.168.50.152	192.168.50.156	HTTP/JSON	713	HTTP/1.1 200 OK , JSON (application/json)
438	234.253451	192.168.50.156	172.217.14.202	TCP	66	[TCP Retransmission] 53404 → 443 [SYN, ECE, CWR] Seq=0 Win=8192 Len=0 MSS=1460 WS=256 SACK_PERM
439	234.282483	192.168.50.156	192.168.50.152	TCP	54	53409 → 80 [ACK] Seq=1254 Ack=660 Win=524800 Len=0
440	235.825214	192.168.50.156	8.8.4.4	TCP	66	53413 → 443 [SYN, ECE, CWR] Seq=0 Win=8192 Len=0 MSS=1460 WS=256 SACK_PERM
441	236.076455	192.168.50.156	8.8.4.4	TCP	66	53414 → 443 [SYN, ECE, CWR] Seq=0 Win=8192 Len=0 MSS=1460 WS=256 SACK_PERM
442	236.401392	192.168.50.156	142.250.69.202	TCP	62	[TCP Retransmission] 53398 → 443 [SYN] Seq=0 Win=8192 Len=0 MSS=1460 SACK_PERM
443	236.481731	192.168.50.156	8.8.4.4	TCP	66	53417 → 443 [SYN, ECE, CWR] Seq=0 Win=8192 Len=0 MSS=1460 WS=256 SACK_PERM
444	236.733826	192.168.50.156	8.8.4.4	TCP	66	53418 → 443 [SYN, ECE, CWR] Seq=0 Win=8192 Len=0 MSS=1460 WS=256 SACK_PERM
445	237.272899	192.168.50.156	142.250.69.202	TCP	66	53421 → 443 [SYN, ECE, CWR] Seq=0 Win=8192 Len=0 MSS=1460 WS=256 SACK_PERM
446	237.273645	172.217.14.202	192.168.50.156	TCP	60	443 → 53374 [RST, ACK] Seq=1 Ack=1 Win=64240 Len=0
447	238.089818	192.168.50.156	192.168.50.152	TCP	54	53409 → 80 [FIN, ACK] Seq=1254 Ack=660 Win=524800 Len=0
448	238.090084	192.168.50.152	192.168.50.156	TCP	60	80 → 53409 [FIN, ACK] Seq=660 Ack=1255 Win=32128 Len=0
449	238.09011	192.168.50.156	192.168.50.152	TCP	54	53409 → 80 [ACK] Seq=1255 Ack=661 Win=524800 Len=0
450	238.826372	192.168.50.156	8.8.4.4	TCP	66	[TCP Retransmission] 53413 → 443 [SYN, ECE, CWR] Seq=0 Win=8192 Len=0 MSS=1460 WS=256 SACK_PERM
451	239.07672	192.168.50.156	8.8.4.4	TCP	66	[TCP Retransmission] 53414 → 443 [SYN, ECE, CWR] Seq=0 Win=8192 Len=0 MSS=1460 WS=256 SACK_PERM
452	239.482677	192.168.50.156	8.8.4.4	TCP	66	[TCP Retransmission] 53417 → 443 [SYN, ECE, CWR] Seq=0 Win=8192 Len=0 MSS=1460 WS=256 SACK_PERM
453	239.733943	192.168.50.156	8.8.4.4	TCP	66	[TCP Retransmission] 53418 → 443 [SYN, ECE, CWR] Seq=0 Win=8192 Len=0 MSS=1460 WS=256 SACK_PERM
454	240.006301	192.168.50.156	172.217.14.202	TCP	62	[TCP Retransmission] 53403 → 443 [SYN] Seq=0 Win=8192 Len=0 MSS=1460 SACK_PERM
455	240.253887	192.168.50.156	172.217.14.202	TCP	62	[TCP Retransmission] 53404 → 443 [SYN] Seq=0 Win=8192 Len=0 MSS=1460 SACK_PERM
456	240.273861	192.168.50.156	142.250.69.202	TCP	66	[TCP Retransmission] 53421 → 443 [SYN, ECE, CWR] Seq=0 Win=8192 Len=0 MSS=1460 WS=256 SACK_PERM
457	241.195263	180.163.238.133	192.168.50.156	SSL	62	Continuation Data
458	241.195582	192.168.50.156	180.163.238.133	SSL	67	Continuation Data
459	241.195718	180.163.238.133	192.168.50.156	TCP	60	443 → 50456 [ACK] Seq=9 Ack=14 Win=64240 Len=0
460	244.827183	192.168.50.156	8.8.4.4	TCP	62	[TCP Retransmission] 53413 → 443 [SYN] Seq=0 Win=8192 Len=0 MSS=1460 SACK_PERM
461	245.077801	192.168.50.156	8.8.4.4	TCP	62	[TCP Retransmission] 53414 → 443 [SYN] Seq=0 Win=8192 Len=0 MSS=1460 SACK_PERM
462	245.483272	192.168.50.156	8.8.4.4	TCP	62	[TCP Retransmission] 53417 → 443 [SYN] Seq=0 Win=8192 Len=0 MSS=1460 SACK_PERM
463	245.734071	192.168.50.156	8.8.4.4	TCP	62	[TCP Retransmission] 53418 → 443 [SYN] Seq=0 Win=8192 Len=0 MSS=1460 SACK_PERM
464	246.27525	192.168.50.156	142.250.69.202	TCP	62	[TCP Retransmission] 53421 → 443 [SYN] Seq=0 Win=8192 Len=0 MSS=1460 SACK_PERM
465	248.402558	142.250.69.202	192.168.50.156	TCP	60	54144 → 443 [SYN] Seq=0 Win=64240 Len=0 MSS=1460 WS=256 SACK_PERM
466	248.402836	192.168.50.156	142.251.33.74	TCP	66	53441 → 443 [SYN, ECE, CWR] Seq=0 Win=8192 Len=0 MSS=1460 WS=256 SACK_PERM
467	250.191535	192.168.50.156	180.163.252.201	TCP	55	[TCP Keep-Alive] 49742 → 80 [ACK] Seq=17 Ack=17 Win=63760 Len=1
468	250.191644	180.163.252.201	192.168.50.156	TCP	60	[TCP Keep-Alive ACK] 80 → 49742 [ACK] Seq=17 Ack=18 Win=64240 Len=0
469	251.403034	192.168.50.156	142.251.33.74	TCP	66	[TCP Retransmission] 53441 → 443 [SYN, ECE, CWR] Seq=0 Win=8192 Len=0 MSS=1460 WS=256 SACK_PERM
470	252.009435	172.217.14.202	192.168.50.156	TCP	60	443 → 53403 [RST, ACK] Seq=1 Ack=1 Win=64240 Len=0
471	252.259225	172.217.14.202	192.168.50.156	TCP	60	443 → 53404 [RST, ACK] Seq=1 Ack=1 Win=64240 Len=0
472	256.471952	192.168.50.156	142.250.217.106	TCP	66	53453 → 443 [SYN, ECE, CWR] Seq=0 Win=8192 Len=0 MSS=1460 WS=256 SACK_PERM
473	256.723675	192.168.50.156	142.250.217.106	TCP	66	53454 → 443 [SYN, ECE, CWR] Seq=0 Win=8192 Len=0 MSS=1460 WS=256 SACK_PERM
474	256.828279	8.8.4.4	192.168.50.156	TCP	60	443 → 53413 [RST, ACK] Seq=1 Ack=1 Win=64240 Len=0
475	256.828586	192.168.50.156	8.8.8.8	TCP	66	53455 → 443 [SYN, ECE, CWR] Seq=0 Win=8192 Len=0 MSS=1460 WS=256 SACK_PERM
476	257.077779	192.168.50.156	8.8.8.8	TCP	66	53457 → 443 [SYN, ECE, CWR] Seq=0 Win=8192 Len=0 MSS=1460 WS=256 SACK_PERM
477	257.079774	8.8.4.4	192.168.50.156	TCP	60	443 → 53414 [RST, ACK] Seq=1 Ack=1 Win=64240 Len=0
478	257.403319	192.168.50.156	142.251.33.74	TCP	62	[TCP Retransmission] 53441 → 443 [SYN] Seq=0 Win=8192 Len=0 MSS=1460 SACK_PERM
479	257.484347	192.168.50.156	8.8.8.8	TCP	66	53460 → 443 [SYN, ECE, CWR] Seq=0 Win=8192 Len=0 MSS=1460 WS=256 SACK_PERM
480	257.48509	8.8.4.4	192.168.50.156	TCP	60	443 → 53417 [RST, ACK] Seq=1 Ack=1 Win=64240 Len=0
481	257.73445	192.168.50.156	8.8.8.8	TCP	66	53461 → 443 [SYN, ECE, CWR] Seq=0 Win=8192 Len=0 MSS=1460 WS=256 SACK_PERM
482	257.735137	8.8.4.4	192.168.50.156	TCP	60	443 → 53418 [RST, ACK] Seq=1 Ack=1 Win=64240 Len=0
483	258.275988	142.250.69.202	192.168.50.156	TCP	60	54144 → 443 [SYN] Seq=0 Win=64240 Len=0 MSS=1460 WS=256 SACK_PERM
484	258.276263	192.168.50.156	142.251.33.74	TCP	66	53463 → 443 [SYN, ECE, CWR] Seq=0 Win=8192 Len=0 MSS=1460 WS=256 SACK_PERM
485	259.472022	192.168.50.156	142.250.217.106	TCP	66	[TCP Retransmission] 53453 → 443 [SYN, ECE, CWR] Seq=0 Win=8192 Len=0 MSS=1460 WS=256 SACK_PERM
486	259.724432	192.168.50.156	142.250.217.106	TCP	66	[TCP Retransmission] 53454 → 443 [SYN, ECE, CWR] Seq=0 Win=8192 Len=0 MSS=1460 WS=256 SACK_PERM
487	259.829231	192.168.50.156	8.8.8.8	TCP	66	[TCP Retransmission] 53455 → 443 [SYN, ECE, CWR] Seq=0 Win=8192 Len=0 MSS=1460 WS=256 SACK_PERM
488	260.078517	192.168.50.156	8.8.8.8	TCP	66	[TCP Retransmission] 53457 → 443 [SYN, ECE, CWR] Seq=0 Win=8192 Len=0 MSS=1460 WS=256 SACK_PERM
489	260.483593	192.168.50.156	8.8.8.8	TCP	66	[TCP Retransmission] 53460 → 443 [SYN, ECE, CWR] Seq=0 Win=8192 Len=0 MSS=1460 WS=256 SACK_PERM
490	260.735066	192.168.50.156	8.8.8.8	TCP	66	[TCP Retransmission] 53461 → 443 [SYN, ECE, CWR] Seq=0 Win=8192 Len=0 MSS=1460 WS=256 SACK_PERM
491	261.276587	192.168.50.156	142.251.33.74	TCP	66	[TCP Retransmission] 53463 → 443 [SYN, ECE, CWR] Seq=0 Win=8192 Len=0 MSS=1460 WS=256 SACK_PERM
492	261.486834	192.168.50.156	20.197.71.89	TLSv1.2	127	Application Data
493	261.487019	20.197.71.89	192.168.50.156	TCP	60	443 → 49705 [ACK] Seq=1 Ack=74 Win=64240 Len=0
494	261.57673	20.197.71.89	192.168.50.156	TLSv1.2	228	Application Data
495	261.586832	192.168.50.156	20.197.71.89	TCP	54	49705 → 443 [ACK] Seq=74 Ack=175 Win=64066 Len=0
496	264.217955	192.168.50.156	192.168.50.152	TCP	66	53473 → 80 [SYN, ECE, CWR] Seq=0 Win=8192 Len=0 MSS=1460 WS=256 SACK_PERM
497	264.218187	192.168.50.152	192.168.50.156	TCP	66	80 → 53473 [SYN, ACK] Seq=0 Ack=1 Win=29200 Len=0 MSS=1460 SACK_PERM WS=128
498	264.218268	192.168.50.156	192.168.50.152	TCP	54	53473 → 80 [ACK] Seq=1 Ack=1 Win=525568 Len=0
499	264.218491	192.168.50.156	192.168.50.152	HTTP	1307	GET /api/health/ HTTP/1.1 
500	264.218623	192.168.50.152	192.168.50.156	TCP	60	80 → 53473 [ACK] Seq=1 Ack=1254 Win=32128 Len=0
501	264.232451	192.168.50.152	192.168.50.156	HTTP/JSON	711	HTTP/1.1 200 OK , JSON (application/json)
502	264.283109	192.168.50.156	192.168.50.152	TCP	54	53473 → 80 [ACK] Seq=1254 Ack=658 Win=524800 Len=0
503	265.471939	192.168.50.156	142.250.217.106	TCP	62	[TCP Retransmission] 53453 → 443 [SYN] Seq=0 Win=8192 Len=0 MSS=1460 SACK_PERM
504	265.724999	192.168.50.156	142.250.217.106	TCP	62	[TCP Retransmission] 53454 → 443 [SYN] Seq=0 Win=8192 Len=0 MSS=1460 SACK_PERM
505	265.830955	192.168.50.156	8.8.8.8	TCP	62	[TCP Retransmission] 53455 → 443 [SYN] Seq=0 Win=8192 Len=0 MSS=1460 SACK_PERM
506	266.079695	192.168.50.156	8.8.8.8	TCP	62	[TCP Retransmission] 53457 → 443 [SYN] Seq=0 Win=8192 Len=0 MSS=1460 SACK_PERM
507	266.484338	192.168.50.156	8.8.8.8	TCP	62	[TCP Retransmission] 53460 → 443 [SYN] Seq=0 Win=8192 Len=0 MSS=1460 SACK_PERM
508	266.735683	192.168.50.156	8.8.8.8	TCP	62	[TCP Retransmission] 53461 → 443 [SYN] Seq=0 Win=8192 Len=0 MSS=1460 SACK_PERM
509	267.27725	192.168.50.156	142.251.33.74	TCP	62	[TCP Retransmission] 53463 → 443 [SYN] Seq=0 Win=8192 Len=0 MSS=1460 SACK_PERM
510	268.096082	192.168.50.156	192.168.50.152	TCP	54	53473 → 80 [FIN, ACK] Seq=1254 Ack=658 Win=524800 Len=0
511	268.096383	192.168.50.152	192.168.50.156	TCP	60	80 → 53473 [FIN, ACK] Seq=658 Ack=1255 Win=32128 Len=0
512	268.096409	192.168.50.156	192.168.50.152	TCP	54	53473 → 80 [ACK] Seq=1255 Ack=659 Win=524800 Len=0
513	269.404506	192.168.50.156	142.250.217.106	TCP	66	53480 → 443 [SYN, ECE, CWR] Seq=0 Win=8192 Len=0 MSS=1460 WS=256 SACK_PERM
514	269.407239	142.250.33.74	192.168.50.156	TCP	60	54144 → 443 [SYN] Seq=0 Win=64240 Len=0 MSS=1460 WS=256 SACK_PERM
515	270.836499	192.168.50.156	142.250.217.110	TCP	66	53486 → 443 [SYN, ECE, CWR] Seq=0 Win=8192 Len=0 MSS=1460 WS=256 SACK_PERM
516	271.087675	192.168.50.156	142.250.217.110	TCP	66	53487 → 443 [SYN, ECE, CWR] Seq=0 Win=8192 Len=0 MSS=1460 WS=256 SACK_PERM
517	272.405384	192.168.50.156	142.250.217.106	TCP	66	[TCP Retransmission] 53480 → 443 [SYN, ECE, CWR] Seq=0 Win=8192 Len=0 MSS=1460 WS=256 SACK_PERM
518	273.016589	192.168.50.156	180.163.151.34	TCP	66	53493 → 443 [SYN, ECE, CWR] Seq=0 Win=8192 Len=0 MSS=1460 WS=256 SACK_PERM
519	273.024272	180.163.151.34	192.168.50.156	TCP	60	443 → 53493 [SYN, ACK] Seq=0 Ack=1 Win=64240 Len=0 MSS=1460
520	273.024329	192.168.50.156	180.163.151.34	TCP	54	53493 → 443 [ACK] Seq=1 Ack=1 Win=64240 Len=0
521	273.024769	192.168.50.156	180.163.151.34	TLSv1.3	2262	Client Hello (SNI=clientservices.googleapis.com)
522	273.025058	180.163.151.34	192.168.50.156	TCP	60	443 → 53493 [ACK] Seq=1 Ack=1461 Win=64240 Len=0
523	273.025058	180.163.151.34	192.168.50.156	TCP	60	443 → 53493 [ACK] Seq=1 Ack=2209 Win=64240 Len=0
524	273.084183	180.163.151.34	192.168.50.156	TLSv1.3	1514	Server Hello, Change Cipher Spec
525	273.084183	180.163.151.34	192.168.50.156	TLSv1.3	72	Application Data
526	273.084296	192.168.50.156	180.163.151.34	TCP	54	53493 → 443 [ACK] Seq=2209 Ack=1479 Win=64240 Len=0
527	273.084759	192.168.50.156	180.163.151.34	TLSv1.3	128	Change Cipher Spec, Application Data
528	273.084895	180.163.151.34	192.168.50.156	TCP	60	443 → 53493 [ACK] Seq=1479 Ack=2283 Win=64240 Len=0
529	273.084953	192.168.50.156	180.163.151.34	TLSv1.3	146	Application Data
530	273.085027	180.163.151.34	192.168.50.156	TCP	60	443 → 53493 [ACK] Seq=1479 Ack=2375 Win=64240 Len=0
531	273.08513	192.168.50.156	180.163.151.34	TLSv1.3	425	Application Data
532	273.085213	180.163.151.34	192.168.50.156	TCP	60	443 → 53493 [ACK] Seq=1479 Ack=2746 Win=64240 Len=0
533	273.122807	180.163.151.34	192.168.50.156	TLSv1.3	1042	Application Data, Application Data
534	273.123096	192.168.50.156	180.163.151.34	TLSv1.3	85	Application Data
535	273.123265	180.163.151.34	192.168.50.156	TCP	60	443 → 53493 [ACK] Seq=2467 Ack=2777 Win=64240 Len=0
536	273.131555	180.163.151.34	192.168.50.156	TLSv1.3	85	Application Data
537	273.182297	192.168.50.156	180.163.151.34	TCP	54	53493 → 443 [ACK] Seq=2777 Ack=2498 Win=63221 Len=0
538	273.268867	180.163.151.34	192.168.50.156	TLSv1.3	557	Application Data, Application Data, Application Data
539	273.269548	192.168.50.156	180.163.151.34	TLSv1.3	93	Application Data
540	273.269722	180.163.151.34	192.168.50.156	TCP	60	443 → 53493 [ACK] Seq=3001 Ack=2816 Win=64240 Len=0
541	273.272795	192.168.50.156	142.250.217.110	TCP	66	53494 → 443 [SYN, ECE, CWR] Seq=0 Win=8192 Len=0 MSS=1460 WS=256 SACK_PERM
542	273.272942	192.168.50.156	8.8.4.4	TCP	66	53495 → 443 [SYN, ECE, CWR] Seq=0 Win=8192 Len=0 MSS=1460 WS=256 SACK_PERM
543	273.273081	192.168.50.156	142.250.217.106	TCP	66	53496 → 443 [SYN, ECE, CWR] Seq=0 Win=8192 Len=0 MSS=1460 WS=256 SACK_PERM
544	273.273606	192.168.50.156	8.8.4.4	TCP	66	53497 → 443 [SYN, ECE, CWR] Seq=0 Win=8192 Len=0 MSS=1460 WS=256 SACK_PERM
545	273.273673	192.168.50.156	180.163.151.34	TCP	54	53493 → 443 [FIN, ACK] Seq=2816 Ack=3001 Win=64240 Len=0
546	273.273794	180.163.151.34	192.168.50.156	TCP	60	443 → 53493 [ACK] Seq=3001 Ack=2817 Win=64239 Len=0
547	273.280496	180.163.151.34	192.168.50.156	TCP	60	443 → 53493 [FIN, PSH, ACK] Seq=3001 Ack=2817 Win=64239 Len=0
548	273.280531	192.168.50.156	180.163.151.34	TCP	54	53493 → 443 [ACK] Seq=2817 Ack=3002 Win=64240 Len=0
549	276.272826	192.168.50.156	8.8.4.4	TCP	66	[TCP Retransmission] 53495 → 443 [SYN, ECE, CWR] Seq=0 Win=8192 Len=0 MSS=1460 WS=256 SACK_PERM
550	276.272826	192.168.50.156	142.250.217.110	TCP	66	[TCP Retransmission] 53494 → 443 [SYN, ECE, CWR] Seq=0 Win=8192 Len=0 MSS=1460 WS=256 SACK_PERM
551	276.27283	192.168.50.156	142.250.217.106	TCP	66	[TCP Retransmission] 53496 → 443 [SYN, ECE, CWR] Seq=0 Win=8192 Len=0 MSS=1460 WS=256 SACK_PERM
552	276.273865	192.168.50.156	8.8.4.4	TCP	66	[TCP Retransmission] 53497 → 443 [SYN, ECE, CWR] Seq=0 Win=8192 Len=0 MSS=1460 WS=256 SACK_PERM
						
